https://w3id.org/kouigenjimonogatari/data/0085-01.json,85,1,ねられたまはぬまゝには我はかく人ににくまれてもならはぬをこよひなむはし
https://w3id.org/kouigenjimonogatari/data/0085-02.json,85,2,めてうしとよをおもひしりぬれははつかしくてなからふましうこそおもひなり
https://w3id.org/kouigenjimonogatari/data/0085-03.json,85,3,ぬれなとのたまへはなみたをさへこほしてふしたりいとらうたしとおほすてさ
https://w3id.org/kouigenjimonogatari/data/0085-04.json,85,4,くりのほそくちいさきほとかみのいとなかゝらさりしけはひのさまかよひたる
https://w3id.org/kouigenjimonogatari/data/0085-05.json,85,5,もおもひなしにやあはれなりあなかちにかゝつらひたとりよらむも人わろかる
https://w3id.org/kouigenjimonogatari/data/0085-06.json,85,6,へくまめやかにめさましとおほしあかしつゝれいのやうにものたまひまつはさ
https://w3id.org/kouigenjimonogatari/data/0085-07.json,85,7,す夜ふかういてたまへはこのこはいといとをしくさう〱しと思ふ女もなみ
https://w3id.org/kouigenjimonogatari/data/0085-08.json,85,8,〱ならすかたはらいたしと思ふに御せうそこもたえてなしおほしこりにける
https://w3id.org/kouigenjimonogatari/data/0085-09.json,85,9,と思にもやかてつれなくてやみ給なましかはうからまししゐていとをしき御ふ
https://w3id.org/kouigenjimonogatari/data/0085-10.json,85,10,るまひのたえさらむもうたてあるへしよきほとにかくてとちめてんとおもふも
https://w3id.org/kouigenjimonogatari/data/0085-11.json,85,11,のからたゝならすなかめかちなりきみは心つきなしとおほしなからかくてはえ
https://w3id.org/kouigenjimonogatari/data/0085-12.json,85,12,やむましう御こゝろにかゝり人わろくおもほしわひてこきみにいとつらうもう
https://w3id.org/kouigenjimonogatari/data/0085-13.json,85,13,れたうもおほゆるにしゐておもひかへせと心にしもしたかはすくるしきをさり
https://w3id.org/kouigenjimonogatari/data/0085-14.json,85,14,ぬへきおりみてたいめむすへくたはかれとのたまひわたれはわつらはしけれと
https://w3id.org/kouigenjimonogatari/data/0086-01.json,86,1,かゝるかたにてものたまひまつはすはうれしうおほえけりおさなき心地にいか
https://w3id.org/kouigenjimonogatari/data/0086-02.json,86,2,ならんおりとまちわたるにきのかみくにゝくたりなとして女とちのとやかなる
https://w3id.org/kouigenjimonogatari/data/0086-03.json,86,3,ゆふやみのみちたと〱しけなるまきれにわかくるまにてゐてたてまつるこの
https://w3id.org/kouigenjimonogatari/data/0086-04.json,86,4,こもおさなきをいかならむとおほせとさのみもえおほしのとむましけれはさり
https://w3id.org/kouigenjimonogatari/data/0086-05.json,86,5,けなきすかたにてかとなとさゝぬさきにといそきおはす人みぬかたよりひきい
https://w3id.org/kouigenjimonogatari/data/0086-06.json,86,6,れておろしたてまつるわらはなれはとのゐ人なともことにみいれついせうせす
https://w3id.org/kouigenjimonogatari/data/0086-07.json,86,7,心やすしひむかしのつまとにたてたてまつりてわれはみなみのすみのまよりか
https://w3id.org/kouigenjimonogatari/data/0086-08.json,86,8,うしたゝきのゝしりていりぬこたちあらはなりといふなりなそかうあつきにこ
https://w3id.org/kouigenjimonogatari/data/0086-09.json,86,9,のかうしはおろされたるととへはひるよりにしの御かたのわたらせ給てこうた
https://w3id.org/kouigenjimonogatari/data/0086-10.json,86,10,せたまふといふさてむかひゐたらむをみはやとおもひてやをらあゆみいてゝす
https://w3id.org/kouigenjimonogatari/data/0086-11.json,86,11,たれのはさまにいり給ぬこのいりつるかうしはまたさゝねはひまみゆるにより
https://w3id.org/kouigenjimonogatari/data/0086-12.json,86,12,てにしさまにみとをし給へはこのきはにたてたるひやう風はしのかたをしたゝ
https://w3id.org/kouigenjimonogatari/data/0086-13.json,86,13,まれたるにまきるへき几帳なともあつけれはにやうちかけていとよくみいれら
https://w3id.org/kouigenjimonogatari/data/0086-14.json,86,14,る火ちかふともしたりもやのなかはしらにそはめる人やわか心かくるとまつめ
https://w3id.org/kouigenjimonogatari/data/0087-01.json,87,1,とゝめたまへはこきあやのひとへかさねなめりなにゝかあらむうへにきてかし
https://w3id.org/kouigenjimonogatari/data/0087-02.json,87,2,らつきほそやかにちいさき人のものけなきすかたそしたるかほなとはさしむか
https://w3id.org/kouigenjimonogatari/data/0087-03.json,87,3,ひたらむ人なとにもわさとみゆましうもてなしたりてつきやせ〱にていたう
https://w3id.org/kouigenjimonogatari/data/0087-04.json,87,4,ひきかくしためりいまひとりはひむかしむきにてのこる所なくみゆしろきうす
https://w3id.org/kouigenjimonogatari/data/0087-05.json,87,5,物のひとへかさね二あひのこうちきたつものないかしろにきなしてくれなゐの
https://w3id.org/kouigenjimonogatari/data/0087-06.json,87,6,こしひきゆへるきはまてむねあらはにはうそくなるもてなしなりいとしろうお
https://w3id.org/kouigenjimonogatari/data/0087-07.json,87,7,かしけにつふ〱とこゑてそゝろかなる人の頭つきひたいつきものあさやかに
https://w3id.org/kouigenjimonogatari/data/0087-08.json,87,8,まみくちつきいとあひきやうつきはなやかなるかたちなりかみはいとふさやか
https://w3id.org/kouigenjimonogatari/data/0087-09.json,87,9,にてなかくはあらねとさかりはかたのほときよけにすへていとねちけたる所な
https://w3id.org/kouigenjimonogatari/data/0087-10.json,87,10,くおかしけなる人とみえたりむへこそおやのよになくは思らめとおかしくみ給
https://w3id.org/kouigenjimonogatari/data/0087-11.json,87,11,心ちそなをしつかなるけをそへはやとふとみゆるかとなきにはあるましこうち
https://w3id.org/kouigenjimonogatari/data/0087-12.json,87,12,はてゝけちさすわたりこゝろとけにみえてきは〱とさうとけはおくの人はい
https://w3id.org/kouigenjimonogatari/data/0087-13.json,87,13,としつかにのとめてまち給へやそこは持にこそあらめこのわたりのこうをこそ
https://w3id.org/kouigenjimonogatari/data/0087-14.json,87,14,なといへといてこのたひはまけにけりすみの所いて〱とおよひをかゝめてと
https://w3id.org/kouigenjimonogatari/data/0088-01.json,88,1,をはたみそよそなとかさふるさまいよのゆけたもたと〱しかるましうみゆす
https://w3id.org/kouigenjimonogatari/data/0088-02.json,88,2,こししなをくれたりたとしへなく〱ちおほひてさやかにもみせねとめをしつけ
https://w3id.org/kouigenjimonogatari/data/0088-03.json,88,3,たまへれはをのつからそはめもみゆめすこしはれたる心ちしてはななともあさ
https://w3id.org/kouigenjimonogatari/data/0088-04.json,88,4,やかなるところなふねひれてにほはしきところもみえすいひたつれはわろきに
https://w3id.org/kouigenjimonogatari/data/0088-05.json,88,5,よれるかたちをいといたうもてつけてこのまされる人よりは心あらむとめとゝ
https://w3id.org/kouigenjimonogatari/data/0088-06.json,88,6,めつへきさましたりにきわゝしうあひきやうつきおかしけなるをいよ〱ほこ
https://w3id.org/kouigenjimonogatari/data/0088-07.json,88,7,りかにうちとけてわらひなとそほるれはにほひおほくみえてさるかたにいとお
https://w3id.org/kouigenjimonogatari/data/0088-08.json,88,8,かしき人さまなりあはつけしとはおほしなからまめならぬ御こゝろはこれもえ
https://w3id.org/kouigenjimonogatari/data/0088-09.json,88,9,おほしはなつましかりけりみたまふかきりの人はうちとけたる世なくひきつく
https://w3id.org/kouigenjimonogatari/data/0088-10.json,88,10,ろひそはめたるうはへをのみこそみ給へかくうちとけたる人のありさまかいま
https://w3id.org/kouigenjimonogatari/data/0088-11.json,88,11,みなとはまたし給はさりつることなれはなに心もなうさやかなるはいとおしな
https://w3id.org/kouigenjimonogatari/data/0088-12.json,88,12,からひさしうみたまはまほしきにこきみいてくる心ちすれはやをらいて給ぬわ
https://w3id.org/kouigenjimonogatari/data/0088-13.json,88,13,たとのゝとくちによりゐたまへりいとかたしけなしとおもひてれいならぬ人侍
https://w3id.org/kouigenjimonogatari/data/0088-14.json,88,14,てえちかふもより侍らすさてこよひもやかへしてんとするいとあさましうから
https://w3id.org/kouigenjimonogatari/data/0089-01.json,89,1,うこそあへけれとのたまへはなとてかあなたにかへり侍りなはたはかり侍なん
https://w3id.org/kouigenjimonogatari/data/0089-02.json,89,2,ときこゆさもなひかしつへきけしきにこそはあらめわらはなれとものゝこゝろ
https://w3id.org/kouigenjimonogatari/data/0089-03.json,89,3,はへ人のけしきみつへくしつまれるをとおほすなりけり五うちはてつるにやあ
https://w3id.org/kouigenjimonogatari/data/0089-04.json,89,4,らむうちそよめく心ちしてひと〱あかるゝけはひなとす也わか君はいつくに
https://w3id.org/kouigenjimonogatari/data/0089-05.json,89,5,おはしますならむこのみかうしはさしてんとてならすなりしつまりぬなりいり
https://w3id.org/kouigenjimonogatari/data/0089-06.json,89,6,てさらはたはかれとの給このこもいもうとの御こゝろはたはむところなくまめ
https://w3id.org/kouigenjimonogatari/data/0089-07.json,89,7,たちたれはいひあはせむかたなくて人すくなゝらんおりにいれたてまつらんと
https://w3id.org/kouigenjimonogatari/data/0089-08.json,89,8,思なりけりきのかみのいもうともこなたにあるか我にかいまみせさせよとのた
https://w3id.org/kouigenjimonogatari/data/0089-09.json,89,9,まへといかてかさは侍らんかうしには几帳そへて侍ときこゆさかしされともお
https://w3id.org/kouigenjimonogatari/data/0089-10.json,89,10,かしくおほせとみつとはしらせしいとおしとおほして夜ふくることの心もとな
https://w3id.org/kouigenjimonogatari/data/0089-11.json,89,11,さをの給こたみはつまとをたゝきているみな人〱しつまりねにけりこのさう
https://w3id.org/kouigenjimonogatari/data/0089-12.json,89,12,しくちにまろはねたらむかせふきとをせとてたゝみひろけてふすこたちひむか
https://w3id.org/kouigenjimonogatari/data/0089-13.json,89,13,しのひさしにいとあまたねたるへしとはなちつるはらはへもそなたに入てふし
https://w3id.org/kouigenjimonogatari/data/0089-14.json,89,14,ぬれはとはかりそらねして火あかきかたにひやう風をひろけてかけほのかなる
https://w3id.org/kouigenjimonogatari/data/0090-01.json,90,1,にやをら入たてまつるいかにそおこかましき事もこそとおほすにいとつゝまし
https://w3id.org/kouigenjimonogatari/data/0090-02.json,90,2,けれとみちひくまゝにもやの木丁のかたひらひきあけていとやをらいり給とす
https://w3id.org/kouigenjimonogatari/data/0090-03.json,90,3,れとみなしつまれるよの御そのけはひやはらかなるしもいとしるかりけり女は
https://w3id.org/kouigenjimonogatari/data/0090-04.json,90,4,さこそわすれ給をうれしきにおもひなせとあやしくゆめのやうなることをこゝ
https://w3id.org/kouigenjimonogatari/data/0090-05.json,90,5,ろにはなるゝおりなきころにて心とけたるいたにねられすなむひるはなかめ夜
https://w3id.org/kouigenjimonogatari/data/0090-06.json,90,6,はねさめかちなれは春ならぬこのめもいとなくなけかしきに五うちつる君こよ
https://w3id.org/kouigenjimonogatari/data/0090-07.json,90,7,ひはこなたにといまめかしくうちかたらひてねにけりわかき人はなにこゝろな
https://w3id.org/kouigenjimonogatari/data/0090-08.json,90,8,くいとようまとろみたるへしかゝるけはひのいとかうはしくうちにほふにかほ
https://w3id.org/kouigenjimonogatari/data/0090-09.json,90,9,をもたけたるにひとへうちかけたる几帳のすきまにくらけれとうちみしろきよ
https://w3id.org/kouigenjimonogatari/data/0090-10.json,90,10,るけはひいとしるしあさましくおほえてともかくも思わかれすやをらおきいて
https://w3id.org/kouigenjimonogatari/data/0090-11.json,90,11,ゝすゝしなるひとへをひとつきてすへりいてにけり君はいり給てたゝひとりふ
https://w3id.org/kouigenjimonogatari/data/0090-12.json,90,12,したるをこゝろやすくおほすゆかのしもに二人はかりそふしたるきぬをゝしや
https://w3id.org/kouigenjimonogatari/data/0090-13.json,90,13,りてより給へるにありしけはひよりはもの〱しくおほゆれとおもほしうもよ
https://w3id.org/kouigenjimonogatari/data/0090-14.json,90,14,らすかしいきたなきさまなとそあやしくかはりてやう〱みあらはし給てあさ
https://w3id.org/kouigenjimonogatari/data/0091-01.json,91,1,ましくこ〱ろやましけれと人たかへとたとりてみえんもおこかましくあやしと
https://w3id.org/kouigenjimonogatari/data/0091-02.json,91,2,おもふへしほいの人をたつねよらむもかはかりのかるゝこゝろあめれはかひな
https://w3id.org/kouigenjimonogatari/data/0091-03.json,91,3,ふおこにこそおもはめとおほすかのおかしかりつるほかけならはいかゝはせむ
https://w3id.org/kouigenjimonogatari/data/0091-04.json,91,4,におほしなるもわろき御こゝろあさゝなめりかしやう〱めさめていとおほえ
https://w3id.org/kouigenjimonogatari/data/0091-05.json,91,5,すあさましきにあきれたるけしきにてなにのこゝろふかくいとおしきようゐも
https://w3id.org/kouigenjimonogatari/data/0091-06.json,91,6,なし世中をまたおもひしらぬほとよりはされはみたるかたにてあえかにもおも
https://w3id.org/kouigenjimonogatari/data/0091-07.json,91,7,ひまとはすわれともしらせしとおほせといかにしてかゝることそとのちに思め
https://w3id.org/kouigenjimonogatari/data/0091-08.json,91,8,くらさむもわかためにはことにもあらねとあのつらき人のあなかちになをつゝ
https://w3id.org/kouigenjimonogatari/data/0091-09.json,91,9,むもさすかにいとをしけれはたひ〱の御かたゝかへにことつけ給しさまをい
https://w3id.org/kouigenjimonogatari/data/0091-10.json,91,10,とかういひなし給ふたとらむ人は心えつへけれとまたいとわかき心地にさこそ
https://w3id.org/kouigenjimonogatari/data/0091-11.json,91,11,さしすきたるやうなれとえしも思わかすにくしとはなけれと御心とまるへきゆ
https://w3id.org/kouigenjimonogatari/data/0091-12.json,91,12,へもなき心ちしてなをかのうれたき人の心をいみしくおほすいつくにはいまき
https://w3id.org/kouigenjimonogatari/data/0091-13.json,91,13,れてかたくなしとおもひゐたらむかくしうねき人はありかたきものをとおほす
https://w3id.org/kouigenjimonogatari/data/0091-14.json,91,14,しもあやにくにまきれかたふおもひいてられ給この人のなま心なくわかやかな
https://w3id.org/kouigenjimonogatari/data/0092-01.json,92,1,るけはひもあはれなれはさすかになさけ〱しくちきりをかせ給人しりたるこ
https://w3id.org/kouigenjimonogatari/data/0092-02.json,92,2,とよりもかやうなるはあはれもそふ事となむ昔人もいひけるあひおもひたまへ
https://w3id.org/kouigenjimonogatari/data/0092-03.json,92,3,よつゝむことなきにしもあらねはみなから心にもえまかすましくなんありける
https://w3id.org/kouigenjimonogatari/data/0092-04.json,92,4,またさるへき人〱もゆるされしかしとかねてむねいたくなん忘てまちたまへ
https://w3id.org/kouigenjimonogatari/data/0092-05.json,92,5,よなとなを〱しくかたらひ給人の思侍らんことのはつかしきになんえきこえ
https://w3id.org/kouigenjimonogatari/data/0092-06.json,92,6,さすましきとうらもなくいふなへて人にしらせはこそあらめこのちいさきうへ
https://w3id.org/kouigenjimonogatari/data/0092-07.json,92,7,人につたへてきこえんけしきなくもてなし給へなといひをきてかのぬきすへし
https://w3id.org/kouigenjimonogatari/data/0092-08.json,92,8,たるとみゆるうす衣をとりていて給ぬこ君ちかふふしたるをおこし給へはうし
https://w3id.org/kouigenjimonogatari/data/0092-09.json,92,9,ろめたうおもひつゝねけれはふとおとろきぬとをやをらをしあくるにおいたる
https://w3id.org/kouigenjimonogatari/data/0092-10.json,92,10,こたちのこゑにてあれはたそとおとろ〱しくとふわつらはしくてまろそとい
https://w3id.org/kouigenjimonogatari/data/0092-11.json,92,11,らふ夜中にこはなそとありかせ給とさかしかりてとさまへくいとにくゝてあら
https://w3id.org/kouigenjimonogatari/data/0092-12.json,92,12,すこゝもとへいつるそとて君ををしいてたてまつるにあかつきちかき月くまな
https://w3id.org/kouigenjimonogatari/data/0092-13.json,92,13,くさしいてゝふと人のかけみえけれはまたおはするはたそとゝふ民部のおもと
https://w3id.org/kouigenjimonogatari/data/0092-14.json,92,14,なめりけしうはあらぬおもとのたけたちかなといふたけたかき人のつねにわら
https://w3id.org/kouigenjimonogatari/data/0093-01.json,93,1,はるゝをいふ也けりおい人これをつらねてありきけるとおもひていまたゝ今た
https://w3id.org/kouigenjimonogatari/data/0093-02.json,93,2,ちならひ給ひなむといふ〱われもこのとよりいててくわひしけれはえはたを
https://w3id.org/kouigenjimonogatari/data/0093-03.json,93,3,しかへさてわたとのゝくちにかひそひてかくれたち給へれはこのおもとさしよ
https://w3id.org/kouigenjimonogatari/data/0093-04.json,93,4,りておもとはこよひはうへにやさふらひ給つるおとゝひよりはらをやみていと
https://w3id.org/kouigenjimonogatari/data/0093-05.json,93,5,わりなけれはしもに侍つるを人すくななりとてめしゝかはよへまうのほりしか
https://w3id.org/kouigenjimonogatari/data/0093-06.json,93,6,となをえたふましくなむとうれふいらへもきかてあなはら〱いまきこえんと
https://w3id.org/kouigenjimonogatari/data/0093-07.json,93,7,てすきぬるにからふしていてたまふなをかゝるありきはかろ〱しくあやしか
https://w3id.org/kouigenjimonogatari/data/0093-08.json,93,8,りけりといよ〱おほしこりぬへしこ君御くるまのしりにて二条院におはしま
https://w3id.org/kouigenjimonogatari/data/0093-09.json,93,9,しぬありさまの給ひておさなかりけりとあはめ給てかの人のこ〱ろをつまはし
https://w3id.org/kouigenjimonogatari/data/0093-10.json,93,10,きをしつゝうらみ給いとをしうてものもえきこえすいとふかうにくみ給へかめ
https://w3id.org/kouigenjimonogatari/data/0093-11.json,93,11,れは身もうくおもひはてぬなとかよそにてもなつかしきいらへはかりはし給ま
https://w3id.org/kouigenjimonogatari/data/0093-12.json,93,12,しき伊与の介におとりけるみこそなと心つきなしとおもひてのたまふありつる
https://w3id.org/kouigenjimonogatari/data/0093-13.json,93,13,こうちきをさすかに御そのしたにひきいれておほとのこもれりこ君をおまへに
https://w3id.org/kouigenjimonogatari/data/0093-14.json,93,14,ふせてよろつにうらみかつはかたらひ給あこはらうたけれとつらきゆかりにこ
https://w3id.org/kouigenjimonogatari/data/0094-01.json,94,1,そえおもひはつましけれとまめやかにのたまふをいとわひしと思たりしはしう
https://w3id.org/kouigenjimonogatari/data/0094-02.json,94,2,ちやすみ給へとねられ給はす御すゝりいそきめしてさしはへたる御ふみにはあ
https://w3id.org/kouigenjimonogatari/data/0094-03.json,94,3,らてたゝうかみにてならひのやうにかきすさひたまふ
https://w3id.org/kouigenjimonogatari/data/0094-04.json,94,4,　　うつせみのみをかへてける木のもとになを人からのなつかしきかなとかき
https://w3id.org/kouigenjimonogatari/data/0094-05.json,94,5,たまへるをふところにひき入てもたりかの人もいかにおもふらんといとをしけ
https://w3id.org/kouigenjimonogatari/data/0094-06.json,94,6,れとかた〱おもほしかへして御ことつけもなしかのうす衣はこうちきのいと
https://w3id.org/kouigenjimonogatari/data/0094-07.json,94,7,なつかしき人かにしめるをみちかくならしてみゐたまへりこ君かしこにいきた
https://w3id.org/kouigenjimonogatari/data/0094-08.json,94,8,れはあねきみまちつけていみしくの給ふあさましかりしにとかうまきらはして
https://w3id.org/kouigenjimonogatari/data/0094-09.json,94,9,も人のおもひけむことさり所なきにいとなむわりなきいとかう心おさなきをか
https://w3id.org/kouigenjimonogatari/data/0094-10.json,94,10,つはいかにおもほすらんとてはつかしめ給ひたりみきにくるしう思へとかの御
https://w3id.org/kouigenjimonogatari/data/0094-11.json,94,11,てならひとりいてたりさすかにとりてみ給かのもぬけをいかに伊勢をのあまの
https://w3id.org/kouigenjimonogatari/data/0094-12.json,94,12,しほなれてやなと思もたゝならすいとよろつにみたれてにしの君も物はつかし
https://w3id.org/kouigenjimonogatari/data/0094-13.json,94,13,き心ちしてわたり給にけりまたしる人もなきことなれは人しれすうちなかめて
https://w3id.org/kouigenjimonogatari/data/0094-14.json,94,14,ゐたりこきみのわたりありくにつけてもむねのみふたかれと御せうそこもなし
https://w3id.org/kouigenjimonogatari/data/0095-01.json,95,1,あさましと思ひうるかたもなくてされたる心にものあはれなるへしつれなき人
https://w3id.org/kouigenjimonogatari/data/0095-02.json,95,2,もさこそしつむれいとあさはかにもあらぬ御けしきをありしなからのわか身な
https://w3id.org/kouigenjimonogatari/data/0095-03.json,95,3,らはととり返すものならねとしのひかたけれはこの御たゝうかみのかたつかた
https://w3id.org/kouigenjimonogatari/data/0095-04.json,95,4,に
https://w3id.org/kouigenjimonogatari/data/0095-05.json,95,5,　　うつせみのはにをく露の木かくれてしのひ〱にぬるゝそてかな
https://w3id.org/kouigenjimonogatari/data/0101-01.json,101,1,六條わたりの御しのひありきのころ内よりまかて給なかやとりに大貳のめのと
https://w3id.org/kouigenjimonogatari/data/0101-02.json,101,2,のいたくわつらひてあまになりにけるとふらはむとて五条なるいゑたつねてお
https://w3id.org/kouigenjimonogatari/data/0101-03.json,101,3,はしたり御くるまいるへきかとはさしたりけれは人してこれ光めさせてまたせ
https://w3id.org/kouigenjimonogatari/data/0101-04.json,101,4,給ける程むつかしけなるおほちのさまをみはたし給へるにこのいゑのかたはら
https://w3id.org/kouigenjimonogatari/data/0101-05.json,101,5,にひかきといふものあたらしうしてかみははしとみ四五けむはかりあけわたし
https://w3id.org/kouigenjimonogatari/data/0101-06.json,101,6,てすたれなともいとしろうすゝしけなるにおかしきひたいつきのすきかけあま
https://w3id.org/kouigenjimonogatari/data/0101-07.json,101,7,たみえてのそくたちさまよふらむしもつかたおもひやるにあなかちにたけたか
https://w3id.org/kouigenjimonogatari/data/0101-08.json,101,8,き心地そするいかなるものゝつとへるならむとやうかはりておほさる御くるま
https://w3id.org/kouigenjimonogatari/data/0101-09.json,101,9,もいたくやつしたまへりさきもおはせ給はすたれとかしらむとうちとけ給てす
https://w3id.org/kouigenjimonogatari/data/0101-10.json,101,10,こしさしのそきたまへれはかとはしとみのやうなるをしあけたるみいれのほと
https://w3id.org/kouigenjimonogatari/data/0101-11.json,101,11,なくものはかなきすまひをあはれにいつこかさしてとおもほしなせはたまのう
https://w3id.org/kouigenjimonogatari/data/0101-12.json,101,12,てなもおなしこと也きりかけたつものにいとあをやかなるかつらの心ちよけに
