https://w3id.org/kouigenjimonogatari/data/0162-13.json,162,13,しめくらすことおほくてまとろませ給はすそやといひしかとも夜もいたうふけ
https://w3id.org/kouigenjimonogatari/data/0162-14.json,162,14,にけりうちにも人のねぬけはひしるくていとしのひたれとすゝのけうそくにひ
https://w3id.org/kouigenjimonogatari/data/0163-01.json,163,1,きならさるゝをとほのきこえなつかしううちそよめくをとなひあてはかなりと
https://w3id.org/kouigenjimonogatari/data/0163-02.json,163,2,きゝたまひてほともなくちかけれはとにたてわたしたる屏風の中をすこしひき
https://w3id.org/kouigenjimonogatari/data/0163-03.json,163,3,あけてあふきをならし給へはおほえなき心ちすへかめれとききしらぬやうにや
https://w3id.org/kouigenjimonogatari/data/0163-04.json,163,4,とてゐさりいつる人あなりすこししそきてあやしひかみゝにやとたとるをきゝ
https://w3id.org/kouigenjimonogatari/data/0163-05.json,163,5,給ひてほとけの御しるへはくらきにいりてもさらにたかうましかなるものをと
https://w3id.org/kouigenjimonogatari/data/0163-06.json,163,6,の給ふ御こゑのいとはかうあてなるにうちいてむこはつかひもはつかしけれと
https://w3id.org/kouigenjimonogatari/data/0163-07.json,163,7,いかなるかたの御しるへにかおほつかなくときこゆけにうちつけなりとおほめ
https://w3id.org/kouigenjimonogatari/data/0163-08.json,163,8,き給はむもことはりなれと
https://w3id.org/kouigenjimonogatari/data/0163-09.json,163,9,　　はつ草のわかはのうへをみつるよりたひねの袖も露そかはかぬときこえ給
https://w3id.org/kouigenjimonogatari/data/0163-10.json,163,10,ひてむやとの給ふさらにかやうの御せうそこうけ給はりわくへき人もものした
https://w3id.org/kouigenjimonogatari/data/0163-11.json,163,11,まはぬさまはしろしめしたりけなるをたれにかはときこゆをのつからさるやう
https://w3id.org/kouigenjimonogatari/data/0163-12.json,163,12,ありてきこゆるならんと思ひなし給へかしとの給へはいりてきこゆあないまめ
https://w3id.org/kouigenjimonogatari/data/0163-13.json,163,13,かしこの君やよついたるほとにおはするとそおほすらんさるにてはかのわかく
https://w3id.org/kouigenjimonogatari/data/0163-14.json,163,14,さをいかてきい給へることそとさま〱あやしきにこゝろみたれてひさしうな
https://w3id.org/kouigenjimonogatari/data/0164-01.json,164,1,れはなさけなしとて
https://w3id.org/kouigenjimonogatari/data/0164-02.json,164,2,　　枕ゆふこよひはかりの露けさをみ山のこけにくらへさらなむひかたう侍る
https://w3id.org/kouigenjimonogatari/data/0164-03.json,164,3,ものをときこえ給ふかうやうのつゐてなる御せうそこはまたさらにきこえしら
https://w3id.org/kouigenjimonogatari/data/0164-04.json,164,4,すならはぬ事になむかたしけなくともかゝるついてにまめ〱しうきこえさす
https://w3id.org/kouigenjimonogatari/data/0164-05.json,164,5,へきことなむときこえたまへれはあまきみひか事きゝ給へるならむいとむつか
https://w3id.org/kouigenjimonogatari/data/0164-06.json,164,6,しき御けはひになにことをかはいらへきこえむとの給へははしたなうもこそお
https://w3id.org/kouigenjimonogatari/data/0164-07.json,164,7,ほせと人〱きこゆけにわかやかなる人こそうたてもあらめまめやかにのたま
https://w3id.org/kouigenjimonogatari/data/0164-08.json,164,8,ふかたしけなしとてゐさりより給へりうちつけにあさはかなりと御らんせられ
https://w3id.org/kouigenjimonogatari/data/0164-09.json,164,9,ぬへきつゐてなれと心にはさもおほえ侍らねはほとけはをのつからとておとな
https://w3id.org/kouigenjimonogatari/data/0164-10.json,164,10,〱しうはつかしけなるにつゝまれてとみにもえうちいて給はすけにおもひ給
https://w3id.org/kouigenjimonogatari/data/0164-11.json,164,11,へよりかたきつゐてにかくまてのたまはせきこえさするもいかゝとの給ふあは
https://w3id.org/kouigenjimonogatari/data/0164-12.json,164,12,れにうけたまはる御ありさまをかのすき給にけむ御かはりにおほしないてむや
https://w3id.org/kouigenjimonogatari/data/0164-13.json,164,13,いふかひなきほとのよはひにてむつましかるへき人にもたちをくれ侍りにけれ
https://w3id.org/kouigenjimonogatari/data/0164-14.json,164,14,はあやしううきたるやうにてとし月をこそかさね侍れおなしさまにものし給ふ
https://w3id.org/kouigenjimonogatari/data/0165-01.json,165,1,なるをたくひになさせ給へといときこえまほしきをかゝるおり侍りかたくてな
https://w3id.org/kouigenjimonogatari/data/0165-02.json,165,2,むおほされん所をもはゝからすうちいて侍りぬるときこえたまへはいとうれし
https://w3id.org/kouigenjimonogatari/data/0165-03.json,165,3,う思たまへぬへき御事なからもきこしめしひかめたる事なとや侍らんとつゝま
https://w3id.org/kouigenjimonogatari/data/0165-04.json,165,4,しうなむあやしき身ひとつをたのもし人にする人なむ侍れといとまたいふかひ
https://w3id.org/kouigenjimonogatari/data/0165-05.json,165,5,なきほとにて御らんしゆるさるゝかたも侍りかたけなれはえなむうけ給はりと
https://w3id.org/kouigenjimonogatari/data/0165-06.json,165,6,ゝめられさりけるとの給みなおほつかなからすうけ給はへるものをところせう
https://w3id.org/kouigenjimonogatari/data/0165-07.json,165,7,おほしはゝからて思ひ給へよるさまことなる心のほとを御らんせよときこえ給
https://w3id.org/kouigenjimonogatari/data/0165-08.json,165,8,へといとにけなきことをさもしらての給とおほして心とけたる御いらへもなし
https://w3id.org/kouigenjimonogatari/data/0165-09.json,165,9,そうつおはしぬれはよしかうきこえそめ侍りぬれはいとたのもしうなむとてを
https://w3id.org/kouigenjimonogatari/data/0165-10.json,165,10,したて給つあかつきかたになりにけれは法花三昧をこなふたうのせむ法のこゑ
https://w3id.org/kouigenjimonogatari/data/0165-11.json,165,11,山おろしにつきてきこえくるいとたうとくたきのをとにひゝきあひたり
https://w3id.org/kouigenjimonogatari/data/0165-12.json,165,12,　　吹まよふみやまおろしに夢さめて涙もよほすたきのをとかな
https://w3id.org/kouigenjimonogatari/data/0165-13.json,165,13,　　さしくみに袖ぬらしける山水にすめる心はさはきやはするみゝなれはへり
https://w3id.org/kouigenjimonogatari/data/0165-14.json,165,14,にけりやときこえ給あけ行空はいといたうかすみて山のとりともそこはかとな
https://w3id.org/kouigenjimonogatari/data/0166-01.json,166,1,うさへつりあひたり名もしらぬ木草のはなとも色〱にちりましりにしきをし
https://w3id.org/kouigenjimonogatari/data/0166-02.json,166,2,けるとみゆるにしかのたゝすみありくもめつらしくみ給になやましさもまきれ
https://w3id.org/kouigenjimonogatari/data/0166-03.json,166,3,はてぬひしりうこきもえせねととかうしてこしむまいらせ給ふかれたるこゑの
https://w3id.org/kouigenjimonogatari/data/0166-04.json,166,4,いといたうすきひかめるもあはれにくうつきてたらによみたり御むかへの人
https://w3id.org/kouigenjimonogatari/data/0166-05.json,166,5,〱まいりてをこたり給へるよろこひきこえうちよりも御とふらひあり僧都世
https://w3id.org/kouigenjimonogatari/data/0166-06.json,166,6,にみえぬさまの御くたものなにくれとたにのそこまてほりいていとなみきこえ
https://w3id.org/kouigenjimonogatari/data/0166-07.json,166,7,給ことしはかりのちかひふかう侍りて御をくりにもえまいり侍るましきこと中
https://w3id.org/kouigenjimonogatari/data/0166-08.json,166,8,〱にも思ひ給へらるへきかななときこえ給ておほみきまいり給山水に心とま
https://w3id.org/kouigenjimonogatari/data/0166-09.json,166,9,り侍りぬれとうちよりもおほつかなからせ給へるもかしこけれはなむいまこの
https://w3id.org/kouigenjimonogatari/data/0166-10.json,166,10,花のおりすくさすまいりこむ
https://w3id.org/kouigenjimonogatari/data/0166-11.json,166,11,　　宮人に行てかたらむ山さくら風よりさきにきてもみるへくとの給御もてな
https://w3id.org/kouigenjimonogatari/data/0166-12.json,166,12,しこわつかひさへめもあやなるに
https://w3id.org/kouigenjimonogatari/data/0166-13.json,166,13,　　うとむけの花まちえたる心ちしてみ山さくらにめこそうつらねときこえた
https://w3id.org/kouigenjimonogatari/data/0166-14.json,166,14,まへはほゝゑみて時ありてひとたひひらくなるはかたかなるものをとの給ふひ
https://w3id.org/kouigenjimonogatari/data/0167-01.json,167,1,しり御かはらけ給て
https://w3id.org/kouigenjimonogatari/data/0167-02.json,167,2,　　おく山の松の戸ほそをまれに明てまたみぬ花のかほをみるかなとうちなき
https://w3id.org/kouigenjimonogatari/data/0167-03.json,167,3,てみたてまつるひしり御まもりにとこたてまつるみ給て僧都さうとくたいしの
https://w3id.org/kouigenjimonogatari/data/0167-04.json,167,4,くたらよりえたまへりけるこむかうしのすゝのたまのさうそくしたるやかてそ
https://w3id.org/kouigenjimonogatari/data/0167-05.json,167,5,のくによりいれたるはこのからめいたるをすきたるふくろにいれてこえうのえ
https://w3id.org/kouigenjimonogatari/data/0167-06.json,167,6,たにつけてこむるりのつほともに御くすりともいれてふちさくらなとにつけて
https://w3id.org/kouigenjimonogatari/data/0167-07.json,167,7,ところにつけたる御をくりものともさゝけたてまつり給ふきみひしりよりはし
https://w3id.org/kouigenjimonogatari/data/0167-08.json,167,8,めと経しつるほうしのふせともまうけのものともさま〱にとりにつかはした
https://w3id.org/kouigenjimonogatari/data/0167-09.json,167,9,りけれはそのわたりの山かつまてさるへきものとも給ひ御す経なとしていて給
https://w3id.org/kouigenjimonogatari/data/0167-10.json,167,10,うちにそうついり給てかのきこえ給しことまねひきこえ給へとともかくもたゝ
https://w3id.org/kouigenjimonogatari/data/0167-11.json,167,11,いまはきこえむかたなしもし御心さしあらはいま四五年をすくしてこそはとも
https://w3id.org/kouigenjimonogatari/data/0167-12.json,167,12,かくもとの給へはさなむとおなしさまにのみあるをほいなしとおほす御せうそ
https://w3id.org/kouigenjimonogatari/data/0167-13.json,167,13,こ僧都のもとなるちいさきわらはして
https://w3id.org/kouigenjimonogatari/data/0167-14.json,167,14,　　ゆふまくれほのかに花のいろをみてけさはかすみのたちそわつらふ御返し
https://w3id.org/kouigenjimonogatari/data/0168-01.json,168,1,　　まことにや花のあたりはたちうきとかすむる空のけしきをもみむとよしあ
https://w3id.org/kouigenjimonogatari/data/0168-02.json,168,2,るてのいとあてなるをうちすてかい給へり御車にたてまつるほと大殿よりいつ
https://w3id.org/kouigenjimonogatari/data/0168-03.json,168,3,ちともなくておはしましにけることゝて御むかへの人〱きみたちなとあまた
https://w3id.org/kouigenjimonogatari/data/0168-04.json,168,4,まいり給へり頭中将左中弁さらぬきみたちもしたひきこえてかうやうの御とも
https://w3id.org/kouigenjimonogatari/data/0168-05.json,168,5,にはつかうまつり侍らむと思ひ給ふるをあさましくをくらさせ給へることゝう
https://w3id.org/kouigenjimonogatari/data/0168-06.json,168,6,らみきこえていといみしき花のかけにしはしもやすらはすたちかへり侍らむは
https://w3id.org/kouigenjimonogatari/data/0168-07.json,168,7,あかぬわさかなとの給ふいはかくれのこけのうへになみゐてかはらけまいるお
https://w3id.org/kouigenjimonogatari/data/0168-08.json,168,8,ちくる水のさまなとゆへあるたきのもとなり頭中将ふところなりけるふえとり
https://w3id.org/kouigenjimonogatari/data/0168-09.json,168,9,いてゝふきすましたり弁のきみあふきはかなううちならしてとよらの寺のにし
https://w3id.org/kouigenjimonogatari/data/0168-10.json,168,10,なるやとうたふ人よりはことなるきみたちを源氏の君いといたううちなやみて
https://w3id.org/kouigenjimonogatari/data/0168-11.json,168,11,いはによりゐたまへるはたくひなくゆゝしき御ありさまにそなに事にもめうつ
https://w3id.org/kouigenjimonogatari/data/0168-12.json,168,12,るましかりけるれいのひちりきふくすいしむさうのふえもたせたるすきものな
https://w3id.org/kouigenjimonogatari/data/0168-13.json,168,13,とありそうつきむをみつからもてまいりてこれたゝ御てひとつあそはしておな
https://w3id.org/kouigenjimonogatari/data/0168-14.json,168,14,しうは山の鳥もおとろかし侍らむとせちにきこえ給へはみたり心ちいとたへか
https://w3id.org/kouigenjimonogatari/data/0169-01.json,169,1,たきものをときこえ給へとけにゝくからすかきならしてみなたち給ぬあかすく
https://w3id.org/kouigenjimonogatari/data/0169-02.json,169,2,ちおしといふかひなきほうしわらはへも涙をおとしあへりましてうちにはとし
https://w3id.org/kouigenjimonogatari/data/0169-03.json,169,3,おいたるあまきみたちなとまたさらにかゝる人の御ありさまをみさりつれはこ
https://w3id.org/kouigenjimonogatari/data/0169-04.json,169,4,の世のものともおほえたまはすときこえあへり僧都もあはれなにの契にてかゝ
https://w3id.org/kouigenjimonogatari/data/0169-05.json,169,5,る御さまなからいとむつかしきひのもとのすゑの世にうまれ給へらむとみるに
https://w3id.org/kouigenjimonogatari/data/0169-06.json,169,6,いとなむかなしきとてめをしのこひ給このわかきみおさな心ちにめてたき人か
https://w3id.org/kouigenjimonogatari/data/0169-07.json,169,7,なとみたまひて宮の御ありさまよりもまさり給へるかななとの給さらはかの人
https://w3id.org/kouigenjimonogatari/data/0169-08.json,169,8,の御こになりておはしませよときこゆれはうちうなつきていとようありなむと
https://w3id.org/kouigenjimonogatari/data/0169-09.json,169,9,おほしたりひいなあそひにもゑかい給ふにも源氏のきみとつくりいてゝきよら
https://w3id.org/kouigenjimonogatari/data/0169-10.json,169,10,なるきぬきせかしつき給ふ君はまつうちにまひり給て日ころの御ものかたりな
https://w3id.org/kouigenjimonogatari/data/0169-11.json,169,11,ときこえ給いといたうおとろへにけりとてゆゝしとおほしめしたりひしりのた
https://w3id.org/kouigenjimonogatari/data/0169-12.json,169,12,うとかりける事なとゝはせ給くはしくそうし給へはあさりなとにもなるへきも
https://w3id.org/kouigenjimonogatari/data/0169-13.json,169,13,のにこそあなれをこなひのらうはつもりておほやけにしろしめされさりける事
https://w3id.org/kouigenjimonogatari/data/0169-14.json,169,14,とらうたかりのたまはせけり大殿まいりあひ給て御むかへにもとおもひ給へつ
https://w3id.org/kouigenjimonogatari/data/0170-01.json,170,1,れとしのひたる御ありきにいかゝと思ひはゝかりてなむのとやかに一二日うち
https://w3id.org/kouigenjimonogatari/data/0170-02.json,170,2,やすみ給へとてやかて御をくりつかうまつらむと申たまへはさしもおほさねと
https://w3id.org/kouigenjimonogatari/data/0170-03.json,170,3,ひかされてまかてたまふわか御車にのせたてまつり給ふてみつからはひきいり
https://w3id.org/kouigenjimonogatari/data/0170-04.json,170,4,てたてまつれりもてかしつきゝこえ給へる御心はへのあはれなるをそさすかに
https://w3id.org/kouigenjimonogatari/data/0170-05.json,170,5,心くるしくおほしける殿にもおはしますらむと心つかひし給てひさしくみたま
https://w3id.org/kouigenjimonogatari/data/0170-06.json,170,6,はぬほといとゝたまのうてなにみかきしつらひよろつをとゝのへ給へり女君れ
https://w3id.org/kouigenjimonogatari/data/0170-07.json,170,7,いのはひかくれてとみにもいて給はぬをおとゝせちにきこえ給てからうしてわ
https://w3id.org/kouigenjimonogatari/data/0170-08.json,170,8,たり給へりたゝゑにかきたるものゝひめきみのやうにしすへられてうちみしろ
https://w3id.org/kouigenjimonogatari/data/0170-09.json,170,9,き給事もかたくうるはしうてものし給へはおもふこともうちかすめ山みちのも
https://w3id.org/kouigenjimonogatari/data/0170-10.json,170,10,のかたりをもきこえむいふかひありておかしういらへたまはゝこそあはれなら
https://w3id.org/kouigenjimonogatari/data/0170-11.json,170,11,め世には心もとけすうとくはつかしきものにおほしてとしのかさなるにそへて
https://w3id.org/kouigenjimonogatari/data/0170-12.json,170,12,御心のへたてもまさるをいとくるしくおもはすにとき〱は世のつねなる御け
https://w3id.org/kouigenjimonogatari/data/0170-13.json,170,13,しきをみはやたへかたうわつらひ侍しをもいかゝとたにとひ給はぬこそめつら
https://w3id.org/kouigenjimonogatari/data/0170-14.json,170,14,しからぬ事なれと猶うらめしうときこえ給からうしてとはぬはつらきものにや
https://w3id.org/kouigenjimonogatari/data/0171-01.json,171,1,あらんとしりめにみをこせ給へるまみいとはつかしけにけたかううつくしけな
https://w3id.org/kouigenjimonogatari/data/0171-02.json,171,2,る御かたちなりまれまれはあさましの御事やとはぬなといふきはゝことにこそ
https://w3id.org/kouigenjimonogatari/data/0171-03.json,171,3,侍なれ心うくもの給ひなすかなよとともにはしたなき御もてなしをもしおほし
https://w3id.org/kouigenjimonogatari/data/0171-04.json,171,4,なおるおりもやととさまかうさまに心みきこゆるほといとゝおもほしうとむな
https://w3id.org/kouigenjimonogatari/data/0171-05.json,171,5,めりかしよしやいのちたにとてよるのおましにいり給ひぬ女きみふともいり給
https://w3id.org/kouigenjimonogatari/data/0171-06.json,171,6,はすきこえわつらひ給ひてうちなけきてふし給へるもなま心つきなきにやあら
https://w3id.org/kouigenjimonogatari/data/0171-07.json,171,7,むねふたけにもてなしてとかう世をおほしみたるることおほかりこのわかくさ
https://w3id.org/kouigenjimonogatari/data/0171-08.json,171,8,のおひいてむほとのなをゆかしきをにけないほとゝおもへりしもことはりそか
https://w3id.org/kouigenjimonogatari/data/0171-09.json,171,9,しいひよりかたき事にもあるかないかにかまへてたゝ心やすくむかへとりてあ
https://w3id.org/kouigenjimonogatari/data/0171-10.json,171,10,けくれのなくさめにみん兵部卿の宮はいとあてになまめい給へれとにほひやか
https://w3id.org/kouigenjimonogatari/data/0171-11.json,171,11,になともあらぬをいかてかのひとそうにおほえ給らむひとつきさきはらなれは
https://w3id.org/kouigenjimonogatari/data/0171-12.json,171,12,にやなとおほすゆかりいとむつましきにいかてかとふかうおほゆ又の日御ふみ
https://w3id.org/kouigenjimonogatari/data/0171-13.json,171,13,たてまつれ給へりそうつにもほのめかし給ふへしあまうへにはもてはなれたり
https://w3id.org/kouigenjimonogatari/data/0171-14.json,171,14,し御けしきのつゝましさにおもひ給ふるさまをもえあらはしはて侍らすなりに
https://w3id.org/kouigenjimonogatari/data/0172-01.json,172,1,しをなむかはかりきこゆるにてもをしなへたらぬ心さしのほとを御らんししら
https://w3id.org/kouigenjimonogatari/data/0172-02.json,172,2,はいかにうれしうなとあり中にちひさくひきむすひて
https://w3id.org/kouigenjimonogatari/data/0172-03.json,172,3,　　面影は身をもはなれす山桜心のかきりとめてこしかとよのまの風もうしろ
https://w3id.org/kouigenjimonogatari/data/0172-04.json,172,4,めたくなむとあり御てなとはさるものにてたたはかなうをしつゝみ給へるさま
https://w3id.org/kouigenjimonogatari/data/0172-05.json,172,5,もまたすきたる御めともにはめもあやにこのましうみゆあなかたはらいたやい
https://w3id.org/kouigenjimonogatari/data/0172-06.json,172,6,かゝきこえんとおほしわつらふゆくての御事はなをさりにも思給へなされしを
https://w3id.org/kouigenjimonogatari/data/0172-07.json,172,7,ふりはへさせ給へるにきこえさせむかたなくなむまたなにはつをたにはか〱
https://w3id.org/kouigenjimonogatari/data/0172-08.json,172,8,しうつゝけ侍らさめれはかひなくなむさても
https://w3id.org/kouigenjimonogatari/data/0172-09.json,172,9,　　嵐吹おのへのさくらちらぬまを心とめけるほとのはかなさいとゝうしろめ
https://w3id.org/kouigenjimonogatari/data/0172-10.json,172,10,たうとあり僧都の御返もおなしさまなれはくちおしくて二三日ありてこれみつ
https://w3id.org/kouigenjimonogatari/data/0172-11.json,172,11,をそたてまつれ給少納言のめのとといふ人あへしたつねてくはしふかたらへな
https://w3id.org/kouigenjimonogatari/data/0172-12.json,172,12,との給しらすさもかゝらぬくまなき御心かなさはかりいはけなけなりしけはひ
https://w3id.org/kouigenjimonogatari/data/0172-13.json,172,13,をとまほならねともみしほとを思ひやるもおかしわさとかう御ふみあるをそう
https://w3id.org/kouigenjimonogatari/data/0172-14.json,172,14,つもかしこまりきこえ給ふ少納言にせうそこしてあひたりくはしくおほしの給
https://w3id.org/kouigenjimonogatari/data/0173-01.json,173,1,ふさまおほかたの御ありさまなとかたることはおほかる人にてつき〱しうい
https://w3id.org/kouigenjimonogatari/data/0173-02.json,173,2,ひつゝくれといとわりなき御ほとをいかにおほすにかとゆゝしうなむたれも
https://w3id.org/kouigenjimonogatari/data/0173-03.json,173,3,〱おほしける御ふみにもいとねむころにかいたまひてれいの中にかの御はな
https://w3id.org/kouigenjimonogatari/data/0173-04.json,173,4,ちかきなむなをみたまへまほしきとて
https://w3id.org/kouigenjimonogatari/data/0173-05.json,173,5,　　あさか山あさくも人をおもはぬになとやまの井のかけはなるらむ御かへし
https://w3id.org/kouigenjimonogatari/data/0173-06.json,173,6,　　くみそめてくやしときゝし山の井のあさきなからやかけをみるへきこれみ
https://w3id.org/kouigenjimonogatari/data/0173-07.json,173,7,つもおなしことをきこゆこのわつらひ給事よろしくはこのころすくして京の殿
https://w3id.org/kouigenjimonogatari/data/0173-08.json,173,8,にわたり給てなむきこえさすへきとあるを心もとなうおほすふしつほの宮なや
https://w3id.org/kouigenjimonogatari/data/0173-09.json,173,9,み給ふことありてまかて給へりうへのおほつかなかりなけきゝこえ給ふ御けし
https://w3id.org/kouigenjimonogatari/data/0173-10.json,173,10,きもいと〱おしうみたてまつりなからかゝるおりたにと心もあくかれまとひ
https://w3id.org/kouigenjimonogatari/data/0173-11.json,173,11,ていつくにも〱まうて給はすうちにてもさとにてもひるはつれ〱となかめ
https://w3id.org/kouigenjimonogatari/data/0173-12.json,173,12,くらしてくるれはわう命婦をせめありき給いかゝたはかりけむいとわりなくて
https://w3id.org/kouigenjimonogatari/data/0173-13.json,173,13,みたてまつるほとさへうつゝとはおほえぬそわひしきや宮もあさましかりしを
https://w3id.org/kouigenjimonogatari/data/0173-14.json,173,14,おほしいつるたによとともの御ものおもひなるをさてたにやみなむとふかうお
https://w3id.org/kouigenjimonogatari/data/0174-01.json,174,1,ほしたるにいとうくていみしき御けしきなるものからなつかしうらうたけにさ
https://w3id.org/kouigenjimonogatari/data/0174-02.json,174,2,りとてうちとけすこゝろふかうはつかしけなる御もてなしなとのなを人にゝさ
https://w3id.org/kouigenjimonogatari/data/0174-03.json,174,3,せ給はぬをなとかなのめなることたにうちましり給はさりけむとつらうさへそ
