https://w3id.org/kouigenjimonogatari/data/0241-07.json,241,7,すめをむかへ給へらむやうにそおほしたるまむ所けいしなとをはしめことにわ
https://w3id.org/kouigenjimonogatari/data/0241-08.json,241,8,かちてこゝろもとなからすつかうまつらせ給ふこれみつよりほかの人はおほつ
https://w3id.org/kouigenjimonogatari/data/0241-09.json,241,9,かなくのみおもひきこえたりかのちゝみやもえしりきこえ給はさりけりひめ君
https://w3id.org/kouigenjimonogatari/data/0241-10.json,241,10,はなをとき〱思ひいてきこえ給ときあま君をこひきこえ給おりおほかりきみ
https://w3id.org/kouigenjimonogatari/data/0241-11.json,241,11,のおはするほとはまきらはし給をよるなとは時〱こそとまりたまへこゝかし
https://w3id.org/kouigenjimonogatari/data/0241-12.json,241,12,この御いとまなくてくるれはいて給をしたひきこえ給おりなとあるをいとらう
https://w3id.org/kouigenjimonogatari/data/0241-13.json,241,13,たくおもひきこえ給へり二三日うちにさふらひおほとのにもおはするおりはい
https://w3id.org/kouigenjimonogatari/data/0241-14.json,241,14,といたくくしなとしたまへは心くるしうてはゝなきこもたらむ心ちしてありき
https://w3id.org/kouigenjimonogatari/data/0242-01.json,242,1,もしつ心なくおほえ給そうつはかくなむときゝ給てあやしきものからうれしと
https://w3id.org/kouigenjimonogatari/data/0242-02.json,242,2,なむおもほしけるかの御法事なとし給ふにもいかめしうとふらひきこえ給へり
https://w3id.org/kouigenjimonogatari/data/0242-03.json,242,3,藤つほのまかてたまへる三条の宮に御あり様もゆかしうてまいり給へれは命婦
https://w3id.org/kouigenjimonogatari/data/0242-04.json,242,4,中納言君中務なとやうの人〻たいめしたりけさやかにももてなし給かなとやす
https://w3id.org/kouigenjimonogatari/data/0242-05.json,242,5,からすおもへとしつめておほかたの御物かたりきこえ給ふほとに兵部卿宮まい
https://w3id.org/kouigenjimonogatari/data/0242-06.json,242,6,り給へりこの君おはすときゝ給てたいめし給へりいとよしあるさまして色めか
https://w3id.org/kouigenjimonogatari/data/0242-07.json,242,7,しうなよひたまへるを女にてみむはおかしかりぬへく人しれすみたてまつり給
https://w3id.org/kouigenjimonogatari/data/0242-08.json,242,8,にもかた〱むつましくおほえ給てこまやかに御物かたりなときこえ給宮も此
https://w3id.org/kouigenjimonogatari/data/0242-09.json,242,9,御さまのつねよりもことになつかしううちとけ給へるをいとめてたしとみたて
https://w3id.org/kouigenjimonogatari/data/0242-10.json,242,10,まつりたまひてむこになとはおほしよらて女にてみはやといろめきたる御心に
https://w3id.org/kouigenjimonogatari/data/0242-11.json,242,11,はおもほすくれぬれはみすの内に入給をうらやましくむかしはうへの御もてな
https://w3id.org/kouigenjimonogatari/data/0242-12.json,242,12,しにいとけちかく人つてならてものをもきこえたまひしをこよなううとみ給へ
https://w3id.org/kouigenjimonogatari/data/0242-13.json,242,13,るもつらうおほゆるそわりなきやしは〱もさふらふへけれとことそと侍らぬ
https://w3id.org/kouigenjimonogatari/data/0242-14.json,242,14,ほとはをのつからおこたり侍をさるへき事なとはおほせ事も侍らむこそうれし
https://w3id.org/kouigenjimonogatari/data/0243-01.json,243,1,くなとすく〱しうていて給ひぬ命婦もたはかりきこえむかたなく宮の御けし
https://w3id.org/kouigenjimonogatari/data/0243-02.json,243,2,きもありしよりはいとゝうきふしにおほしをきて心とけぬ御けしきもはつかし
https://w3id.org/kouigenjimonogatari/data/0243-03.json,243,3,くいとをしけれはなにのしるしもなくて過行はかなのちきりやとおほしみたる
https://w3id.org/kouigenjimonogatari/data/0243-04.json,243,4,ゝ事かたみにつきせす少納言はおほえすおかしきよをみるかなこれもこあまう
https://w3id.org/kouigenjimonogatari/data/0243-05.json,243,5,へのこの御事をおほして御をこないにもいのりきこえ給しほとけの御しるしに
https://w3id.org/kouigenjimonogatari/data/0243-06.json,243,6,やとおほゆおほいとのいとやむ事なくておはしますこゝかしこあまたかゝつら
https://w3id.org/kouigenjimonogatari/data/0243-07.json,243,7,ひたまふをそまことにおとなひ給はむほとはむつかしき事もやとおほえけるさ
https://w3id.org/kouigenjimonogatari/data/0243-08.json,243,8,れとかくとりわき給へる御おほえの程はいとたのもしけなりかし御ふくはゝか
https://w3id.org/kouigenjimonogatari/data/0243-09.json,243,9,たは三月こそはとてつこもりにはぬかせたてまつり給ふをまたおやもなくてお
https://w3id.org/kouigenjimonogatari/data/0243-10.json,243,10,ひいて給しかはまはゆき色にはあらてくれなゐむらさき山ふきのちのかきりを
https://w3id.org/kouigenjimonogatari/data/0243-11.json,243,11,れる御こうちきなとをきたまへるさまいみしういまめかしくおかしけなりおと
https://w3id.org/kouigenjimonogatari/data/0243-12.json,243,12,こ君はてうはいにまいり給とてさしのそき給へりけふよりはおとなしくなり給
https://w3id.org/kouigenjimonogatari/data/0243-13.json,243,13,へりやとてうちゑみ給へるいとめてたうあひ行つき給へりいつしかひゐなをし
https://w3id.org/kouigenjimonogatari/data/0243-14.json,243,14,すゑてそゝきゐたまへる三尺のみつしひとよろひにしな〱しつらひすへて又
https://w3id.org/kouigenjimonogatari/data/0244-01.json,244,1,ちひさきやともつくりあつめてたてまつり給へるを所せきまてあそひひろけた
https://w3id.org/kouigenjimonogatari/data/0244-02.json,244,2,まへりなやらふとていぬきかこれをこほち侍にけれはつくろひ侍そとていと大
https://w3id.org/kouigenjimonogatari/data/0244-03.json,244,3,事とおほいたりけにいと心なき人のしわさにも侍なるかないまつくろはせ侍ら
https://w3id.org/kouigenjimonogatari/data/0244-04.json,244,4,むけふはこといみしてなゝひたまひそとていて給けしき所せきを人〻はしにい
https://w3id.org/kouigenjimonogatari/data/0244-05.json,244,5,てゝみたてまつれはひめ君もたちいてゝみたてまつり給てひゝなの中の源しの
https://w3id.org/kouigenjimonogatari/data/0244-06.json,244,6,君つくろひたてゝうちにまいらせなとし給ことしたにすこしおとなひさせ給へ
https://w3id.org/kouigenjimonogatari/data/0244-07.json,244,7,とおにあまりぬる人はひゝなあそひはいみ侍ものをかく御おとこなとまうけた
https://w3id.org/kouigenjimonogatari/data/0244-08.json,244,8,てまつり給てはあるへかしうしめやかにてこそみえたてまつらせ給はめ御くし
https://w3id.org/kouigenjimonogatari/data/0244-09.json,244,9,まいるほとをたにものうくせさせ給なと少納言きこゆ御あそひにのみ心いれ給
https://w3id.org/kouigenjimonogatari/data/0244-10.json,244,10,へれははつかしとおもはせたてまつらむとていへは心のうちに我はさはおとこ
https://w3id.org/kouigenjimonogatari/data/0244-11.json,244,11,まうけてけりこの人〻のおとことてあるはみにくゝこそあれわれはかくおかし
https://w3id.org/kouigenjimonogatari/data/0244-12.json,244,12,けにわかき人をもゝたりけるかなと今そおもほししりけるさはいへと御としの
https://w3id.org/kouigenjimonogatari/data/0244-13.json,244,13,数そふしるしなめりかしかくおさなき御けはひのことにふれてしるけるはとの
https://w3id.org/kouigenjimonogatari/data/0244-14.json,244,14,ゝうちの人〻もあやしと思ひけれといとかうよつかぬ御そひふしならむとはお
https://w3id.org/kouigenjimonogatari/data/0245-01.json,245,1,もはさりけりうちより大殿にまかてたまへれはれひのうるはしうよそほしき御
https://w3id.org/kouigenjimonogatari/data/0245-02.json,245,2,さまにて心うつくしき御けしきもなくくるしけれはことしよりたにすこしよつ
https://w3id.org/kouigenjimonogatari/data/0245-03.json,245,3,きてあらため給御心みえはいかにうれしからむなときこえたまへとわさと人す
https://w3id.org/kouigenjimonogatari/data/0245-04.json,245,4,ゑてかしつき給ときき給しよりはやむ事なくおほしさためたる事にこそはとこ
https://w3id.org/kouigenjimonogatari/data/0245-05.json,245,5,ゝろのみをかれていとゝうとくはつかしくおほさるへししひてみしらぬやうに
https://w3id.org/kouigenjimonogatari/data/0245-06.json,245,6,もてなしてみたれたる御けはひにはえしも心つよからす御いらへなとうちきこ
https://w3id.org/kouigenjimonogatari/data/0245-07.json,245,7,え給へるはなを人よりはいとことなりよとせはかりかこのかみにおはすれはう
https://w3id.org/kouigenjimonogatari/data/0245-08.json,245,8,ちすくしはつかしけにさかりにとゝのほりてみえ給なに事かはこの人のあかぬ
https://w3id.org/kouigenjimonogatari/data/0245-09.json,245,9,所はものし給わか心のあまりけしからぬすさひにかくうらみられたてまつるそ
https://w3id.org/kouigenjimonogatari/data/0245-10.json,245,10,かしとおほししらるおなし大臣ときこゆるなかにもおほえやむ事なくおはする
https://w3id.org/kouigenjimonogatari/data/0245-11.json,245,11,か宮はらにひとりいつきかしつき給御心をこりいとこよなくてすこしもをろか
https://w3id.org/kouigenjimonogatari/data/0245-12.json,245,12,なるをはめさましとおもひきこえ給へるをおとこ君はなとかいとさしもとなら
https://w3id.org/kouigenjimonogatari/data/0245-13.json,245,13,はい給御心のへたてともなるへしおとゝもかくたのもしけなき御心をつらしと
https://w3id.org/kouigenjimonogatari/data/0245-14.json,245,14,おもひきこえ給なからみたてまつり給時はうらみもわすれてかしつきいとなみ
https://w3id.org/kouigenjimonogatari/data/0246-01.json,246,1,きこえ給ふつとめていて給ふ所にさしのそき給て御さうそくし給ふになたかき
https://w3id.org/kouigenjimonogatari/data/0246-02.json,246,2,御をひ御てつからもたせてわたり給て御そのうしろひきつくろひなと御くつを
https://w3id.org/kouigenjimonogatari/data/0246-03.json,246,3,とらぬはかりにし給いとあはれなりこれはないえむなといふ事も侍なるをさや
https://w3id.org/kouigenjimonogatari/data/0246-04.json,246,4,うのおりにこそなときこえ給へはそれはまされるも侍りこれはたゝめなれぬさ
https://w3id.org/kouigenjimonogatari/data/0246-05.json,246,5,まなれはなむとてしひてさゝせたてまつり給けによろつにかしつきたてゝみた
https://w3id.org/kouigenjimonogatari/data/0246-06.json,246,6,てまつり給ふにいけるかひありたまさかにてもかゝらん人をいたしいれてみん
https://w3id.org/kouigenjimonogatari/data/0246-07.json,246,7,にますことあらしとみえ給さむさしにとてもあまた所もありき給はす内春宮一
https://w3id.org/kouigenjimonogatari/data/0246-08.json,246,8,院はかりさては藤つほの三条の宮にそまいり給へるけふはまたことにもみえた
https://w3id.org/kouigenjimonogatari/data/0246-09.json,246,9,まふかなねひ給まゝにゆゝしきまてなりまさり給ふ御有さまかなと人〻めてき
https://w3id.org/kouigenjimonogatari/data/0246-10.json,246,10,こゆるを宮き丁のひまよりほのみ給ふにつけてもおもほす事しけかりけりこの
https://w3id.org/kouigenjimonogatari/data/0246-11.json,246,11,御事のしはすもすきにしか心もとなきにこの月はさりともと宮人もまちきこえ
https://w3id.org/kouigenjimonogatari/data/0246-12.json,246,12,内にもさる御心まうけともありつれなくてたちぬ御ものゝけにやとよ人もきこ
https://w3id.org/kouigenjimonogatari/data/0246-13.json,246,13,えさはくを宮いとわひしうこの事によりみのいたつらになりぬへき事とおほし
https://w3id.org/kouigenjimonogatari/data/0246-14.json,246,14,なけくに御心ちもいとくるしくてなやみ給中将の君はいとゝおもひあはせてみ
https://w3id.org/kouigenjimonogatari/data/0247-01.json,247,1,すほうなとさとはなくて所〱にせさせたまふ世の中のさためなきにつけても
https://w3id.org/kouigenjimonogatari/data/0247-02.json,247,2,かくはかなくてややみなむととりあつめてなけき給ふに二月十よ日のほとにお
https://w3id.org/kouigenjimonogatari/data/0247-03.json,247,3,とこみこむまれ給ひぬれはなこりなくうちにも宮人もよろこひきこえ給いのち
https://w3id.org/kouigenjimonogatari/data/0247-04.json,247,4,なかくもとおもほすは心うけれとこうきてんなとのうけはしけにのたまふとき
https://w3id.org/kouigenjimonogatari/data/0247-05.json,247,5,ゝしをむなしくきゝなし給はましは人はらはれにやとおほしつよりてなむやう
https://w3id.org/kouigenjimonogatari/data/0247-06.json,247,6,〱すこしつゝさはやい給けるうへのいつしかとゆかしけにおほしめしたる事
https://w3id.org/kouigenjimonogatari/data/0247-07.json,247,7,かきりなしかの人しれぬ御心にもいみしう心もとなくて人まにまいり給てうへ
https://w3id.org/kouigenjimonogatari/data/0247-08.json,247,8,のおほつかなかりきこえさせ給をまつみたてまつりてくはしくそうし侍らむと
https://w3id.org/kouigenjimonogatari/data/0247-09.json,247,9,きこえ給へとむつかしけなるほとなれはとてみせたてまつり給はぬもことはり
https://w3id.org/kouigenjimonogatari/data/0247-10.json,247,10,なりさるはいとあさましうめつらかなるまてうつしとり給へるさまたかふへく
https://w3id.org/kouigenjimonogatari/data/0247-11.json,247,11,もあらす宮の御心のおにゝいとくるしく人のみたてまつるもあやしかりつるほ
https://w3id.org/kouigenjimonogatari/data/0247-12.json,247,12,とのあやまりをまさに人のおもひとかめしやさらぬはかなき事をたにきすをも
https://w3id.org/kouigenjimonogatari/data/0247-13.json,247,13,とむる世にいかなる名のつゐにもりいつへきにかとおほしつつくるに身のみそ
https://w3id.org/kouigenjimonogatari/data/0247-14.json,247,14,いと心うき命婦の君にたまさかにあひ給ていみしき事ともをつくし給へとなに
https://w3id.org/kouigenjimonogatari/data/0248-01.json,248,1,のかひあるへきにもあらすわか宮の御事をわりなくおほつかなかりきこえ給へ
https://w3id.org/kouigenjimonogatari/data/0248-02.json,248,2,はなとかうしもあなかちにのたまはすらむ今をのつからみたてまつらせ給ひて
https://w3id.org/kouigenjimonogatari/data/0248-03.json,248,3,むときこえなからおもへるけしきかたみにたゝならすかたはらいたき事なれは
https://w3id.org/kouigenjimonogatari/data/0248-04.json,248,4,まほにもえのたまはていかならむよに人つてならてきこえさせむとてない給さ
https://w3id.org/kouigenjimonogatari/data/0248-05.json,248,5,まそ心くるしき
https://w3id.org/kouigenjimonogatari/data/0248-06.json,248,6,　　いかさまにむかしむすへるちきりにてこのよにかかる中のへたてそかゝる
https://w3id.org/kouigenjimonogatari/data/0248-07.json,248,7,事こそこゝろへかたけれとの給命婦も宮のおもほしたるさまなとをみたてまつ
https://w3id.org/kouigenjimonogatari/data/0248-08.json,248,8,るにえはしたなふもさしはなちきこえす
https://w3id.org/kouigenjimonogatari/data/0248-09.json,248,9,　　みてもおもふみぬはたいかになけくらむこやよの人のまとふてふやみあは
https://w3id.org/kouigenjimonogatari/data/0248-10.json,248,10,れに心ゆるひなき御事ともかなとしのひてきこえけりかくのみいひやるかたな
https://w3id.org/kouigenjimonogatari/data/0248-11.json,248,11,くてかへり給ものから人のものいひもはつらはしきをわりなき事にのたまはせ
https://w3id.org/kouigenjimonogatari/data/0248-12.json,248,12,おほして命婦をもむかしおほひたりしやうにもうちとけむつひ給はす人めたつ
https://w3id.org/kouigenjimonogatari/data/0248-13.json,248,13,ましくなたらかにもてなし給ものから心つきなしとおほすときも有へきをいと
https://w3id.org/kouigenjimonogatari/data/0248-14.json,248,14,はひしく思ひのほかになる心ちすへし四月にうちへまいり給ふほとよりはおほ
https://w3id.org/kouigenjimonogatari/data/0249-01.json,249,1,きにおよすけ給てやう〱おきかへりなとし給あさましきまてまきれところな
https://w3id.org/kouigenjimonogatari/data/0249-02.json,249,2,き御かほつきをおほしよらぬ事にしあれはまたならひなきとちはけにかよひ給
https://w3id.org/kouigenjimonogatari/data/0249-03.json,249,3,へるにこそはとおもほしけりいみしうおもほしかしつく事かきりなし源しの君
https://w3id.org/kouigenjimonogatari/data/0249-04.json,249,4,をかきりなきものにおほしめしなからよの人のゆるしきこゆましかりしにより
https://w3id.org/kouigenjimonogatari/data/0249-05.json,249,5,てはうにもすゑたてまつらすなりにしをあかすくちおしうたゝ人にてかたしけ
https://w3id.org/kouigenjimonogatari/data/0249-06.json,249,6,なき御ありさまかたちにねひもておはするを御らむするまゝに心くるしくおほ
https://w3id.org/kouigenjimonogatari/data/0249-07.json,249,7,しめすをかうやむ事なき御はらにおなしひかりにてさしいて給へれはきすなき
https://w3id.org/kouigenjimonogatari/data/0249-08.json,249,8,たまとおほしかしつくに宮はいかなるにつけてもむねのひまなくやすからすも
https://w3id.org/kouigenjimonogatari/data/0249-09.json,249,9,のをおもほすれいの中将の君こなたにて御あそひなとし給にいたきいてたてま
https://w3id.org/kouigenjimonogatari/data/0249-10.json,249,10,つらせ給てみこたちあまたあれとそこをのみなむかゝる程よりあけ暮みしされ
https://w3id.org/kouigenjimonogatari/data/0249-11.json,249,11,はおもひわたさるゝにやあらむいとよくこそおほえたれいとちいさきほとはみ
https://w3id.org/kouigenjimonogatari/data/0249-12.json,249,12,なかくのみあるわさにやあらむとていみしくうつくしと思ひきこえさせ給へり
https://w3id.org/kouigenjimonogatari/data/0249-13.json,249,13,中将の君おもての色かはる心ちしておそろしうもかたしけなくもうれしくもあ
https://w3id.org/kouigenjimonogatari/data/0249-14.json,249,14,はれにもかた〱うつろふ心ちしてなみたおちぬへし物かたりなとしてうちゑ
https://w3id.org/kouigenjimonogatari/data/0250-01.json,250,1,み給へるかいとゆゝしううつくしきに我(か)身なからこれににたらむはいみしうい
https://w3id.org/kouigenjimonogatari/data/0250-02.json,250,2,たはしうおほえ給そあなかちなるや宮はわりなくかたはらいたきにあせもなか
https://w3id.org/kouigenjimonogatari/data/0250-03.json,250,3,れてそおはしける中将は中〱なる心ちのみたるやうなれはまかて給ぬわか御
https://w3id.org/kouigenjimonogatari/data/0250-04.json,250,4,かたにふし給てむねのやる方なきほとすくして大いとのへとおほすおまへのせ
https://w3id.org/kouigenjimonogatari/data/0250-05.json,250,5,むさいのなにとなくあをみわたれる中にとこ夏の花やかにさきいてたるをおら
https://w3id.org/kouigenjimonogatari/data/0250-06.json,250,6,せ給て命婦の君のもとにかき給事おほかるへし
https://w3id.org/kouigenjimonogatari/data/0250-07.json,250,7,　　よそへつゝみるに心はなくさまて露けさまさるなてしこの花はなにさかな
https://w3id.org/kouigenjimonogatari/data/0250-08.json,250,8,んとおもひたまへしもかひなきよに侍りけれはとありさりぬへきひまにやあり
https://w3id.org/kouigenjimonogatari/data/0250-09.json,250,9,けむ御らむせさせてたゝちりはかりこの花ひらにときこゆるをわか御心にもも
https://w3id.org/kouigenjimonogatari/data/0250-10.json,250,10,のいとあはれにおほししらるゝほとにて
https://w3id.org/kouigenjimonogatari/data/0250-11.json,250,11,　　袖ぬるゝ露のゆかりとおもふにも猶うとまれぬやまとなてしことはかりほ
https://w3id.org/kouigenjimonogatari/data/0250-12.json,250,12,のかにかきさしたるやうなるをよろこひなからたてまつれるれいの事なれはし
https://w3id.org/kouigenjimonogatari/data/0250-13.json,250,13,るしあらしかしとくつをれてなかめふし給へるにむねうちさはきていみしくう
https://w3id.org/kouigenjimonogatari/data/0250-14.json,250,14,れしきにもなみたおちぬつく〱とふしたるにもやるかたなき心ちすれはれい
https://w3id.org/kouigenjimonogatari/data/0251-01.json,251,1,のなくさめにはにしのたいにそわたり給ふしとけなくうちふくたみ給へるひむ
https://w3id.org/kouigenjimonogatari/data/0251-02.json,251,2,くきあされたるうちきすかたにてふえをなつかしうふきすさひつゝのそきたま
https://w3id.org/kouigenjimonogatari/data/0251-03.json,251,3,へれは女君ありつる花の露にぬれたる心ちしてそひふし給へるさまうつくしう
https://w3id.org/kouigenjimonogatari/data/0251-04.json,251,4,らうたけなりあい行こほるゝやうにておはしなからとくもわたり給はぬなまう
https://w3id.org/kouigenjimonogatari/data/0251-05.json,251,5,らめしかりけれはれいならすそむき給へるなるへしはしのかたについゐてこち
https://w3id.org/kouigenjimonogatari/data/0251-06.json,251,6,やとの給へとおとろかすいりぬるいそのとくちすさみて口をゝいしたまへるさ
https://w3id.org/kouigenjimonogatari/data/0251-07.json,251,7,まいみしうされてうつくしあなにくかゝる事くちなれ給にけりなみるめにあく
https://w3id.org/kouigenjimonogatari/data/0251-08.json,251,8,はまさなき事そよとて人めして御こととりよせてひかせたてまつり給さうのこ
https://w3id.org/kouigenjimonogatari/data/0251-09.json,251,9,とはなかのほそをのたへかたきこそ所せけれとてひやうてふにをしくたしてし
https://w3id.org/kouigenjimonogatari/data/0251-10.json,251,10,らへ給かきあはせはかりひきてさしやり給へれはえゑしはてすいとうつくしう
https://w3id.org/kouigenjimonogatari/data/0251-11.json,251,11,ひき給ふちひさき御ほとにさしやりてゆし給御てつきいとうつくしけれはらう
https://w3id.org/kouigenjimonogatari/data/0251-12.json,251,12,たしとおほしてふえふきならしつゝおしへ給いとさとくてかたきてうしともを
https://w3id.org/kouigenjimonogatari/data/0251-13.json,251,13,たゝひとわたりにならひとり給大かたらう〱しうおかしき御心はへを思し事
https://w3id.org/kouigenjimonogatari/data/0251-14.json,251,14,かなふとおほすほそろくせりといふものはなはにくけれとおもしろふふきすさ
https://w3id.org/kouigenjimonogatari/data/0252-01.json,252,1,ひ給へるにかきあはせまたわかけれとはうしたかはす上手めきたりおほとなふ
https://w3id.org/kouigenjimonogatari/data/0252-02.json,252,2,らまいりてゑともなと御らむするにいて給へしとありつれは人〻こはつくりき
https://w3id.org/kouigenjimonogatari/data/0252-03.json,252,3,こえてあめふり侍ぬへしなといふにひめ君れいの心ほそくてくし給へりゑもみ
https://w3id.org/kouigenjimonogatari/data/0252-04.json,252,4,さしてうつふしておはすれはいとらうたくて御くしのいとめてたくこほれかゝ
https://w3id.org/kouigenjimonogatari/data/0252-05.json,252,5,りたるをかきなてゝほかなるほとは恋しくやあるとのたまへはうなつき給われ
https://w3id.org/kouigenjimonogatari/data/0252-06.json,252,6,もひとひもみたてまつらぬはいとくるしうこそあれとおさなくおはするほとは
https://w3id.org/kouigenjimonogatari/data/0252-07.json,252,7,心やすくおもひきこえてまつくね〱しくうらむる人の心やふらしと思てむつ
https://w3id.org/kouigenjimonogatari/data/0252-08.json,252,8,はしけれはしはしかくもありくそおとなしくみなしてはほかへもさらにいくま
