https://w3id.org/kouigenjimonogatari/data/0308-08.json,308,8,つけさせ給しかはその御かはりにもやかてみたてまつりあつかはむなとつねに
https://w3id.org/kouigenjimonogatari/data/0308-09.json,308,9,の給せてやかてうちすみし給へとたひ〱きこえさせ給しをたにいとあるまし
https://w3id.org/kouigenjimonogatari/data/0308-10.json,308,10,きことゝおもひはなれにしをかく心よりほかにわか〱しき物思をしてつゐに
https://w3id.org/kouigenjimonogatari/data/0308-11.json,308,11,うき名をさへなかしはてつへきことゝおほしみたるゝになをれいのさまにもお
https://w3id.org/kouigenjimonogatari/data/0308-12.json,308,12,はせすさるは大かたの世につけて心にくゝよしあるきこえありてむかしより名
https://w3id.org/kouigenjimonogatari/data/0308-13.json,308,13,たかく物し給へは野の宮の御うつろひのほとにもおかしういまめきたる事おほ
https://w3id.org/kouigenjimonogatari/data/0308-14.json,308,14,くしなして殿上人とものこのましきなとは朝夕の露わけありくをその比のやく
https://w3id.org/kouigenjimonogatari/data/0309-01.json,309,1,になむするなときゝ給ても大将の君はことはりそかしゆへはあくまてつき給へ
https://w3id.org/kouigenjimonogatari/data/0309-02.json,309,2,る物をもし世中にあきはてゝくたり給なはさう〱しくもあるへきかなとさす
https://w3id.org/kouigenjimonogatari/data/0309-03.json,309,3,かにおほされけり御法事なとすきぬれと正日まては猶こもりおはすならはぬ御
https://w3id.org/kouigenjimonogatari/data/0309-04.json,309,4,つれ〱を心くるしかり給て三位中将はつねにまいり給つ〱世中の御物かたり
https://w3id.org/kouigenjimonogatari/data/0309-05.json,309,5,なとまめやかなるも又れいのみたりかはしき事をもきこえいてつゝなくさめき
https://w3id.org/kouigenjimonogatari/data/0309-06.json,309,6,こえ給にかの内侍そうちわらひ給くさはひにはなるめる大将の君はあないとお
https://w3id.org/kouigenjimonogatari/data/0309-07.json,309,7,しやをはおとゝのうへないたうかろめ給ひそといさめ給物からつねにおかしと
https://w3id.org/kouigenjimonogatari/data/0309-08.json,309,8,おほしたりかのいさよひのさやかならさりし秋の事なとさらぬもさま〱のす
https://w3id.org/kouigenjimonogatari/data/0309-09.json,309,9,きことゝもをかたみにくまなくいひあらはし給はて〱はあはれなる世をいひ
https://w3id.org/kouigenjimonogatari/data/0309-10.json,309,10,〱てうちなきなともし給けり時雨うちして物あはれなる暮つかた中将の君に
https://w3id.org/kouigenjimonogatari/data/0309-11.json,309,11,ひ色のなをしさしぬきうすらかに衣かへしていとおゝしうあさやかに心はつか
https://w3id.org/kouigenjimonogatari/data/0309-12.json,309,12,しきさましてまいり給へり君はにしのつまのかうらんにをしかゝりて霜かれの
https://w3id.org/kouigenjimonogatari/data/0309-13.json,309,13,せむさいみ給ほと也けり風あららかにふきしくれさとしたるほと涙もあらそふ
https://w3id.org/kouigenjimonogatari/data/0309-14.json,309,14,心ちして雨となり雲とや成にけんいまはしらすとうちひとりこちてつらつゑつ
https://w3id.org/kouigenjimonogatari/data/0310-01.json,310,1,き給へる御さま女にてはみすてゝなくならむ玉しひかならすとまりなむかしと
https://w3id.org/kouigenjimonogatari/data/0310-02.json,310,2,色めかしき心ちにうちまもられつゝちかうついゐ給へれはしとけなくうちみた
https://w3id.org/kouigenjimonogatari/data/0310-03.json,310,3,れ給へるさまなからひもはかりをさしなをし給これはいますこしこまやかなる
https://w3id.org/kouigenjimonogatari/data/0310-04.json,310,4,夏の御なをしに紅のつやゝかなるひきかさねてやつれ給へるしもみてもあかぬ
https://w3id.org/kouigenjimonogatari/data/0310-05.json,310,5,心ちそする中将もいとあはれなるまみになかめたまへり
https://w3id.org/kouigenjimonogatari/data/0310-06.json,310,6,　　雨となりしくるゝ空のうき雲をいつれのかたとわきてなかめむゆくゑなし
https://w3id.org/kouigenjimonogatari/data/0310-07.json,310,7,やとひとりことのやうなるを
https://w3id.org/kouigenjimonogatari/data/0310-08.json,310,8,　　みし人の雨となりにし雲井さへいとゝ時雨にかきくらす比との給御けしき
https://w3id.org/kouigenjimonogatari/data/0310-09.json,310,9,もあさからぬほとしるくみゆれはあやしうとし比はいとしもあらぬ御心さしを
https://w3id.org/kouigenjimonogatari/data/0310-10.json,310,10,院なとゐたちての給はせおとゝの御もてなしも心くるしう大宮の御かたさまに
https://w3id.org/kouigenjimonogatari/data/0310-11.json,310,11,もてはなるましきなとかた〱にさしあひたれはえしもふりすて給はてものう
https://w3id.org/kouigenjimonogatari/data/0310-12.json,310,12,けなる御けしきなからありへ給なめりかしといとおしうみゆるおり〱ありつ
https://w3id.org/kouigenjimonogatari/data/0310-13.json,310,13,るをまことにやむことなくをもきかたはことに思きこえ給けるなめりとみしる
https://w3id.org/kouigenjimonogatari/data/0310-14.json,310,14,にいよ〱くちおしうおほゆよろつにつけてひかりうせぬる心ちしてくんしゐ
https://w3id.org/kouigenjimonogatari/data/0311-01.json,311,1,たかりけりかれたる下草の中にりんたうなてしこなとのさきいてたるをおらせ
https://w3id.org/kouigenjimonogatari/data/0311-02.json,311,2,給て中将のたち給ぬるのちにわか君の御めのとの宰相の君して
https://w3id.org/kouigenjimonogatari/data/0311-03.json,311,3,　　草かれのまかきにのこるなてしこをわかれし秋のかたみとそみるにほひお
https://w3id.org/kouigenjimonogatari/data/0311-04.json,311,4,とりてや御らんせらるらむときこえ給へりけになに心なき御ゑみかほそいみし
https://w3id.org/kouigenjimonogatari/data/0311-05.json,311,5,ううつくしき宮は吹風につけてたに木の葉よりけにもろき御涙はましてとりあ
https://w3id.org/kouigenjimonogatari/data/0311-06.json,311,6,へ給はす
https://w3id.org/kouigenjimonogatari/data/0311-07.json,311,7,　　いまもみてなか〱袖をくたすかなかきほあれにしやまとなてしこ猶いみ
https://w3id.org/kouigenjimonogatari/data/0311-08.json,311,8,しうつれ〱なれはあさかほの宮にけふのあはれはさりとも見しり給らむとお
https://w3id.org/kouigenjimonogatari/data/0311-09.json,311,9,しはからるゝ御心はへなれはくらきほとなれときこえ給たえまとをけれとさの
https://w3id.org/kouigenjimonogatari/data/0311-10.json,311,10,ものとなりにたる御ふみなれはとかなくて御らむせさす空の色したるからのか
https://w3id.org/kouigenjimonogatari/data/0311-11.json,311,11,みに
https://w3id.org/kouigenjimonogatari/data/0311-12.json,311,12,　　わきてこのくれこそ袖は露けゝれ物おもふ秋はあまたへぬれといつも時雨
https://w3id.org/kouigenjimonogatari/data/0311-13.json,311,13,はとあり御手なとの心とゝめてかき給へるつねよりもみ所ありてすくしかたき
https://w3id.org/kouigenjimonogatari/data/0311-14.json,311,14,ほとなりと人もきこえみつからもおほされけれは大うち山をおもひやりきこえ
https://w3id.org/kouigenjimonogatari/data/0312-01.json,312,1,なからえやはとて
https://w3id.org/kouigenjimonogatari/data/0312-02.json,312,2,　　秋きりにたちをくれぬときゝしより時雨ゝ空もいかゝとそおもふとのみほ
https://w3id.org/kouigenjimonogatari/data/0312-03.json,312,3,のかなるすみつきにておもひなし心にくしなに事につけてもみまさりはかたき
https://w3id.org/kouigenjimonogatari/data/0312-04.json,312,4,世なめるをつらき人しもこそとあはれにおほえ給人の御心さまなるつれななか
https://w3id.org/kouigenjimonogatari/data/0312-05.json,312,5,らさるへきおり〱のあはれをすくし給はぬこれこそかたみになさけもみはつ
https://w3id.org/kouigenjimonogatari/data/0312-06.json,312,6,へきわさなれ猶ゆへつきよしつきて人めにみゆはかりなるはあまりのなむもい
https://w3id.org/kouigenjimonogatari/data/0312-07.json,312,7,てきけりたいのひめ君をさはおほしたてしとおほすつれ〱にて恋しと思らむ
https://w3id.org/kouigenjimonogatari/data/0312-08.json,312,8,かしとわするゝおりなけれとたゝめおやなき子をゝきたらむ心ちしてみぬほと
https://w3id.org/kouigenjimonogatari/data/0312-09.json,312,9,うしろめたくいかゝおもふらむとおほえぬそ心やすきわさなりけるくれはてぬ
https://w3id.org/kouigenjimonogatari/data/0312-10.json,312,10,れは御となふらちかくまいらせ給てさるへきかきりの人〱御まへにて物語な
https://w3id.org/kouigenjimonogatari/data/0312-11.json,312,11,とせさせ給中納言の君といふはとしころしのひおほししかとこの御思ひのほと
https://w3id.org/kouigenjimonogatari/data/0312-12.json,312,12,は中〱さやうなるすちにもかけ給はすあはれなる御心かなとみたてまつる大
https://w3id.org/kouigenjimonogatari/data/0312-13.json,312,13,かたにはなつかしううちかたらひ給てかうこの日ころありしよりけにたれも
https://w3id.org/kouigenjimonogatari/data/0312-14.json,312,14,〱まきるゝかたなくみなれ〱てえしもつねにかゝらすは恋しからしやいみ
https://w3id.org/kouigenjimonogatari/data/0313-01.json,313,1,しき事をはさる物にてたゝうちおもひめくらすこそたへかたきことおほかりけ
https://w3id.org/kouigenjimonogatari/data/0313-02.json,313,2,れとの給へはいとゝみななきていふかひなき御事はたゝかきくらす心ちし侍は
https://w3id.org/kouigenjimonogatari/data/0313-03.json,313,3,さる物にてなこりなきさまにあくかれはてさせ給はむほと思給ふるこそときこ
https://w3id.org/kouigenjimonogatari/data/0313-04.json,313,4,えもやらすあはれとみわたし給てなこりなくはいかゝは心あさくもとりなし給
https://w3id.org/kouigenjimonogatari/data/0313-05.json,313,5,哉心なかき人たにあらはみはて給ひなむ物を命こそはかなけれとて火をうちな
https://w3id.org/kouigenjimonogatari/data/0313-06.json,313,6,かめたまへるまみのうちぬれ給へるほとそめてたきとりわきてらうたくし給し
https://w3id.org/kouigenjimonogatari/data/0313-07.json,313,7,ちいさきわらはのおやともゝなくいと心ほそけにおもへることはりにみ給てあ
https://w3id.org/kouigenjimonogatari/data/0313-08.json,313,8,てきはいまはわれをこそはおもふへき人なめれとのたまへはいみしうなくほと
https://w3id.org/kouigenjimonogatari/data/0313-09.json,313,9,なきあこめ人よりはくろうそめてくろきかさみくわむさうのはかまなときたる
https://w3id.org/kouigenjimonogatari/data/0313-10.json,313,10,もおかしきすかた也むかしをわすれさらむ人はつれ〱をしのひてもをさなき
https://w3id.org/kouigenjimonogatari/data/0313-11.json,313,11,人をみすてすものし給へみし世のなこりなく人〱さへかれなはたつきなさも
https://w3id.org/kouigenjimonogatari/data/0313-12.json,313,12,まさりぬへくなむなとみな心なかゝるへきことゝもをの給へといてやいとゝま
https://w3id.org/kouigenjimonogatari/data/0313-13.json,313,13,ちとをにそなり給はむとおもふにいとゝ心ほそし大とのは人々にきは〱ほと
https://w3id.org/kouigenjimonogatari/data/0313-14.json,313,14,をきつゝはかなきもてあそひ物とも又まことにかの御かたみなるへき物なとわ
https://w3id.org/kouigenjimonogatari/data/0314-01.json,314,1,さとならぬさまにとりなしつゝみなくはらせ給けり君はかくてのみもいかてか
https://w3id.org/kouigenjimonogatari/data/0314-02.json,314,2,はつく〱とすくし給はむとて院へまいり給御車さしいてゝこせむなとまいり
https://w3id.org/kouigenjimonogatari/data/0314-03.json,314,3,あつまるほとおりしりかほなる時雨うちそゝきて木の葉さそふ風あはたゝしう
https://w3id.org/kouigenjimonogatari/data/0314-04.json,314,4,吹はらひたるにおまへにさふらふ人〻ものいと心ほそくてすこしひまありつる
https://w3id.org/kouigenjimonogatari/data/0314-05.json,314,5,袖ともうるひわたりぬよさりはやかて二条院にとまり給へしとてさふらひの人
https://w3id.org/kouigenjimonogatari/data/0314-06.json,314,6,〱もかしこにてまちきこえんとなるへしをの〱たちいつるにけふにしもと
https://w3id.org/kouigenjimonogatari/data/0314-07.json,314,7,ちむましき事なれと又なくものかなしおとゝも宮もけふのけしきにまたかなし
https://w3id.org/kouigenjimonogatari/data/0314-08.json,314,8,さあらためておほさる宮の御まへに御せうそこきこえ給へり院におほつかなか
https://w3id.org/kouigenjimonogatari/data/0314-09.json,314,9,りの給するによりけふなむまいり侍あからさまにたちいて侍につけてもけふま
https://w3id.org/kouigenjimonogatari/data/0314-10.json,314,10,てなからへ侍にけるよとみたり心ちのみうこきてなむきこえさせむも中〱に
https://w3id.org/kouigenjimonogatari/data/0314-11.json,314,11,侍へけれはそなたにもまいり侍らぬとあれはいとゝしく宮はめもみえ給はすし
https://w3id.org/kouigenjimonogatari/data/0314-12.json,314,12,つみいりて御返もきこえ給はすおとゝそやかてわたり給へるいとたへかたけに
https://w3id.org/kouigenjimonogatari/data/0314-13.json,314,13,おほして御袖もひきはなち給はすみたてまつる人〱もいとかなし大将の君は
https://w3id.org/kouigenjimonogatari/data/0314-14.json,314,14,よをおほしつゝくることいとさま〱にてなき給さまあはれに心ふかき物から
https://w3id.org/kouigenjimonogatari/data/0315-01.json,315,1,いとさまよくなまめき給へりおととひさしうためらひ給てよはひのつもるには
https://w3id.org/kouigenjimonogatari/data/0315-02.json,315,2,さしもあるましきことにつけてたに涙もろなるわさに侍をましてひるよなうお
https://w3id.org/kouigenjimonogatari/data/0315-03.json,315,3,もひ給へまとはれ侍心をえのとめ侍らねは人めもいとみたりかはしう心よはき
https://w3id.org/kouigenjimonogatari/data/0315-04.json,315,4,さまに侍へけれは院なとにもまいり侍らぬ也ことのついてにはさやうにおもむ
https://w3id.org/kouigenjimonogatari/data/0315-05.json,315,5,けそうせさせ給へいくはくも侍るましきおいのすゑにうちすてられたるかつら
https://w3id.org/kouigenjimonogatari/data/0315-06.json,315,6,うも侍かなとせめて思ひしつめての給けしきいとわりなし君もたひ〱はなう
https://w3id.org/kouigenjimonogatari/data/0315-07.json,315,7,ちかみてをくれさきたつほとのさためなさは世のさかとみ給へしりなからさし
https://w3id.org/kouigenjimonogatari/data/0315-08.json,315,8,あたりておほえ侍心まとひはたくひあるましきわさとなむ院にもありさまそう
https://w3id.org/kouigenjimonogatari/data/0315-09.json,315,9,し侍らむにおしはからせ給てむときこえ給さらは時雨もひまなく侍めるを暮ぬ
https://w3id.org/kouigenjimonogatari/data/0315-10.json,315,10,ほとにとそゝのかしきこえ給うちみまはし給にみき丁のうしろさうしのあなた
https://w3id.org/kouigenjimonogatari/data/0315-11.json,315,11,なとのあきとおりたるなとに女はう卅人はかりおしこりてこきうすきにひ色と
https://w3id.org/kouigenjimonogatari/data/0315-12.json,315,12,もをきつゝみないみしう心ほそけにてうちしほたれつゝゐあつまりたるをいと
https://w3id.org/kouigenjimonogatari/data/0315-13.json,315,13,あはれとみ給おほしすつましき人もとまりたまへれはさりともものゝついてに
https://w3id.org/kouigenjimonogatari/data/0315-14.json,315,14,はたちよらせ給はしやなとなくさめ侍をひとへにおもひやりなき女はうなとは
https://w3id.org/kouigenjimonogatari/data/0316-01.json,316,1,けふをかきりにおほしすてつる古郷と思くむしてなかくわかれぬるかなしひよ
https://w3id.org/kouigenjimonogatari/data/0316-02.json,316,2,りもたゝ時〱なれつかうまつるとし月のなこりなかるへきをなけき侍めるな
https://w3id.org/kouigenjimonogatari/data/0316-03.json,316,3,むことはりなるうちとけおはします事は侍さりつれとさりともつゐにはとあい
https://w3id.org/kouigenjimonogatari/data/0316-04.json,316,4,なたのめし侍つるをけにこそ心ほそきゆふへに侍れとてもなき給ぬいとあさは
https://w3id.org/kouigenjimonogatari/data/0316-05.json,316,5,かなる人〻のなけきにも侍なるかなまことにいかなりともとのとかに思給へつ
https://w3id.org/kouigenjimonogatari/data/0316-06.json,316,6,るほとはをのつから御めかるゝおりも侍つらむを中〱いまはなにをたのみに
https://w3id.org/kouigenjimonogatari/data/0316-07.json,316,7,てかはおこたり侍らんいま御らんしてむとていて給をおととみをくりきこえ給
https://w3id.org/kouigenjimonogatari/data/0316-08.json,316,8,ていり給へるに御しつらひよりはしめありしにかはる事もなけれとうつせみの
https://w3id.org/kouigenjimonogatari/data/0316-09.json,316,9,むなしき心ちそし給御丁のまへに御すゝりなとうちゝらして手ならひすて給へ
https://w3id.org/kouigenjimonogatari/data/0316-10.json,316,10,るをとりてめをおしゝほりつゝみ給をわかき人々はかなしき中にもほをゑむあ
https://w3id.org/kouigenjimonogatari/data/0316-11.json,316,11,るへしあはれなるふる事ともからのもやまとのもかきけかしつゝさうにもまな
https://w3id.org/kouigenjimonogatari/data/0316-12.json,316,12,にもさま〱めつらしきさまにかきませ給へりかしこの御てやと空をあふきて
https://w3id.org/kouigenjimonogatari/data/0316-13.json,316,13,なかめ給よそ人にみたてまつりなさむかおしきなるへしふるき枕ふるき衾たれ
https://w3id.org/kouigenjimonogatari/data/0316-14.json,316,14,とともにかとある所に
https://w3id.org/kouigenjimonogatari/data/0317-01.json,317,1,　　なき玉そいとゝかなしきねしとこのあくかれかたき心ならひに又霜の花し
https://w3id.org/kouigenjimonogatari/data/0317-02.json,317,2,ろしとある所に
https://w3id.org/kouigenjimonogatari/data/0317-03.json,317,3,　　君なくてちりつもりぬるとこなつの露うちはらひいく夜ねぬらむ一日の花
https://w3id.org/kouigenjimonogatari/data/0317-04.json,317,4,なるへし枯てましれり宮に御らんせさせ給ていふかひなき事をはさる物にてか
https://w3id.org/kouigenjimonogatari/data/0317-05.json,317,5,ゝるかなしきたくひ世になくやはと思なしつゝ契なかゝらてかく心をまとはす
https://w3id.org/kouigenjimonogatari/data/0317-06.json,317,6,へくてこそはありけめとかへりてはつらくさきの世を思やりつゝなむさまし侍
https://w3id.org/kouigenjimonogatari/data/0317-07.json,317,7,をたゝ日ころにそへて恋しさのたへかたきとこの大将の君のいまはとよそにな
https://w3id.org/kouigenjimonogatari/data/0317-08.json,317,8,り給はむなんあかすいみしく思たまへらるゝ一日ふつかもみえ給はすかれ〱
https://w3id.org/kouigenjimonogatari/data/0317-09.json,317,9,におはせしをたにあかすむねいたく思侍しをあさゆふのひかりうしなひてはい
https://w3id.org/kouigenjimonogatari/data/0317-10.json,317,10,かてかなからふへからんと御こゑもえしのひあへ給はすない給におまへなるお
https://w3id.org/kouigenjimonogatari/data/0317-11.json,317,11,とな〱しき人なといとかなしくてさとうちなきたるそゝろさむきゆふへのけ
https://w3id.org/kouigenjimonogatari/data/0317-12.json,317,12,しき也わかき人〻は所〱にむれゐつゝをのかとちあはれなる事ともうちかた
https://w3id.org/kouigenjimonogatari/data/0317-13.json,317,13,らひてとのゝおほしのたまはするやうにわか君をみたてまつりてこそはなくさ
https://w3id.org/kouigenjimonogatari/data/0317-14.json,317,14,むへかめれと思ふもいとはかなきほとの御かたみにこそとてをの〱あからさ
https://w3id.org/kouigenjimonogatari/data/0318-01.json,318,1,まにまかてゝまいらむといふもあれはかたみにわかれおしむほとをのかしゝあ
https://w3id.org/kouigenjimonogatari/data/0318-02.json,318,2,はれなる事ともおほかり院へまいり給へれはいといたうおもやせにけりさうし
https://w3id.org/kouigenjimonogatari/data/0318-03.json,318,3,にて日をふるけにやと心くるしけにおほしめしておまへにて物なとまいらせ給
https://w3id.org/kouigenjimonogatari/data/0318-04.json,318,4,てとやかくやとおほしあつかひきこえさせ給へるさまあはれにかたしけなし中
https://w3id.org/kouigenjimonogatari/data/0318-05.json,318,5,宮の御かたにまいり給へれは人〱めつらしかりみたてまつる命婦の君して思
https://w3id.org/kouigenjimonogatari/data/0318-06.json,318,6,つきせぬ事ともをほとふるにつけてもいかにと御せうそこきこえ給へりつねな
https://w3id.org/kouigenjimonogatari/data/0318-07.json,318,7,き世は大かたにもおもふ給へしりにしをめにちかくみ侍つるにいとはしきこと
https://w3id.org/kouigenjimonogatari/data/0318-08.json,318,8,おほく思給へみたれしもたひ〱の御せうそこになくさめ侍てなむけふまても
https://w3id.org/kouigenjimonogatari/data/0318-09.json,318,9,とてさらぬおりたにある御けしきとりそへていと心くるしけなりむもんのうへ
https://w3id.org/kouigenjimonogatari/data/0318-10.json,318,10,の御そににひ色の御したかさねえいまき給へるやつれすかたはなやかなる御よ
https://w3id.org/kouigenjimonogatari/data/0318-11.json,318,11,そひよりもなまめかしさまさり給へり春宮にもひさしうまいらぬおほつかなさ
https://w3id.org/kouigenjimonogatari/data/0318-12.json,318,12,なときこえ給て夜ふけてそまかて給二条院にはかた〱はらひみかきておとこ
https://w3id.org/kouigenjimonogatari/data/0318-13.json,318,13,女まちきこえたり上らうともみなまうのほりてわれも〱とさうそきけさうし
https://w3id.org/kouigenjimonogatari/data/0318-14.json,318,14,たるをみるにつけてもかのゐなみくむしたりつるけしきともそあはれにおもひ
https://w3id.org/kouigenjimonogatari/data/0319-01.json,319,1,いてられ給御さうそくたてまつりかへてにしのたいにわたりたまへり衣かへの
https://w3id.org/kouigenjimonogatari/data/0319-02.json,319,2,御しつらひくもりなくあさやかにみえてよきわか人わらはへのなりすかためや
https://w3id.org/kouigenjimonogatari/data/0319-03.json,319,3,すくとゝのへて少納言かもてなし心もとなき所なう心にくしとみ給ひめ君いと
https://w3id.org/kouigenjimonogatari/data/0319-04.json,319,4,うつくしうひきつくろひておはすひさしかりつるほとにいとこよなうこそおと
https://w3id.org/kouigenjimonogatari/data/0319-05.json,319,5,なひ給にけれとてちいさきみき丁ひきあけてみたてまつり給へはうちそはみて
https://w3id.org/kouigenjimonogatari/data/0319-06.json,319,6,わらひ給へる御さまあかぬ所なしほかけの御かたはらめかしらつきなとたたか
https://w3id.org/kouigenjimonogatari/data/0319-07.json,319,7,の心つくしきこゆる人にたかふ所なくなり行かなとみ給にいとうれしちかくよ
https://w3id.org/kouigenjimonogatari/data/0319-08.json,319,8,り給ておほつかなかりつるほとの事ともなときこえ給て日ころの物かたりのと
https://w3id.org/kouigenjimonogatari/data/0319-09.json,319,9,かにきこえまほしけれといま〱しうおほえ侍れはしはしことかたにやすらひ
https://w3id.org/kouigenjimonogatari/data/0319-10.json,319,10,てまいりこむ今はとたえなくみたてまつるへけれはいとはしうさへやおほされ
https://w3id.org/kouigenjimonogatari/data/0319-11.json,319,11,むとかたらひきこえ給を少納言はうれしときく物から猶あやうく思きこゆやむ
https://w3id.org/kouigenjimonogatari/data/0319-12.json,319,12,ことなきしのひ所おほうかゝつらひ給へれは又わつらはしきやたちかはり給は
